image_url,price_text,image_title
https://pf-online-inventory-images.s3.us-west-1.amazonaws.com/online/fsfixeox/68cfecbb50ff4ebeb55e661ffd7c5d23.jpg,$175,Black oak finish king size mid mod style headboard
https://pf-online-inventory-images.s3.us-west-1.amazonaws.com/online/1dy2lti2/0c775d9fe30446f68d620e52bb3295ac.jpg,$645,Renee navy blue finish wood 8 drawer dresser
https://pf-online-inventory-images.s3.us-west-1.amazonaws.com/online/ksp11oib/79810ff3638146b09cd970edc1be8709.jpg,$195,Casselton king size cherry finish textured geometric design headboard 
https://pf-online-inventory-images.s3.us-west-1.amazonaws.com/online/wpiy3dty/55b6572344f146bd9e8fc3341231c170.jpg,$375,Kegan walnut finish mid mod style 5 drawer chest with rounded edges
https://pf-online-inventory-images.s3.us-west-1.amazonaws.com/online/zt1y5uw2/fcee8f0dcf0b4b5da6471b81e7644317.jpg,$369,Kim black finish wood 8 drawer double dresser
https://pf-online-inventory-images.s3.us-west-1.amazonaws.com/online/22rthlic/b813d17a27344f49aa4731df18dc8451.jpg,$575,Casual Elements Napoleon Ahnalise tan mango wood 6 drawer double dresser 
https://pf-online-inventory-images.s3.us-west-1.amazonaws.com/online/d2jijp41/84c90c1663d2403085844db4bd8f98d3.jpg,$360,Edgerin light pine veneer pressed wood 5 drawer dresser 
https://pf-online-inventory-images.s3.us-west-1.amazonaws.com/online/uorpro0f/9e350124ad3b4606aa02f11175187500.jpg,$445,Keever king size weathered taupe finish wood 2 drawer storage bed
https://pf-online-inventory-images.s3.us-west-1.amazonaws.com/online/hxtztwef/464222298d274b4a8eab2ce5c172703d.jpg,$595,"Mayuzi king brown faux leather Ultimate Comfort Smart Bed w/ massage chair, Bluetooth "
https://pf-online-inventory-images.s3.us-west-1.amazonaws.com/online/pt0wo3vn/52d09b8c6eac41f7900f64f6f18485bc.jpg,$595,Crowson king size espresso finish wood 8 drawer storage platform bed / bookcase headboard 
https://pf-online-inventory-images.s3.us-west-1.amazonaws.com/online/f1pb2gko/58e3b86c300d4e41bb6197c43203ffba.jpg,$559,Celia Queen beige fabric platform bedstead 
https://pf-online-inventory-images.s3.us-west-1.amazonaws.com/online/idmfusip/ae93086453ec44bea7f508ab1ae3f599.jpg,$150,"7 ft long narrow grey velvet tufted seat storage bench - As is, no return!"
https://pf-online-inventory-images.s3.us-west-1.amazonaws.com/online/yunio2sj/03966f206a3648c998d1ff474be4a14a.jpg,$65,Cherry inlaid top demilune 3 drawer nightstand 
https://pf-online-inventory-images.s3.us-west-1.amazonaws.com/online/emld2wbq/f34243198f5840e6b1c8f0f1009153dc.jpg,$195,Universal Spencer white & rustic pine wood 2 drawer nightstand w/ black base & power strip
https://pf-online-inventory-images.s3.us-west-1.amazonaws.com/online/qzlh5en4/9418ad360a1a42d39ec40f98f314acdc.jpg,$295,Hammond white finish wood 8 drawer double dresser
https://pf-online-inventory-images.s3.us-west-1.amazonaws.com/online/rkdryp4e/a5095db91d8f4f569dd75d5d53fe28e3.jpg,$356,Wabbaseka silver finish wood 7 drawer dresser with glitter accent & LED nightlight
https://pf-online-inventory-images.s3.us-west-1.amazonaws.com/online/b2b5g511/fffe69d2096047fcbe8da29bac892b15.jpg,$1095,"Antique tall 2 piece Japanese multi door/ drawer Tansu chest, Kasane Keyaki Meiji period"
https://pf-online-inventory-images.s3.us-west-1.amazonaws.com/online/qwwofffo/ef31f146ca274e0da487549e0a0b4a07.jpg,$295,Copeland Furniture Sarah solid maple 2 drawer nightstand 
https://pf-online-inventory-images.s3.us-west-1.amazonaws.com/online/eloorygp/820bca8473b64296a8625c6d97ae55eb.jpg,$455,Vintage Heywood Wakefield solid maple 4 drawer chest
https://pf-online-inventory-images.s3.us-west-1.amazonaws.com/online/32cixa0t/99674e4a9a9e4c619c0861583d52c315.jpg,$495,Vintage Heywood Wakefield solid maple 5 drawer chest
https://pf-online-inventory-images.s3.us-west-1.amazonaws.com/online/x341meui/b8377635572642059becbe47e0b942a2.jpg,$280,Room & Board Copenhagen birch 1 drawer nightstand with open shelf on wheels
https://pf-online-inventory-images.s3.us-west-1.amazonaws.com/online/um5tzhar/d4e54f105d0e4ccb989ac22b637ae40a.jpg,$214,Vintage Heywood Wakefield solid maple 1 drawer nightstand with open storage 
https://pf-online-inventory-images.s3.us-west-1.amazonaws.com/online/y0mesued/c13b4195b4cc4f76846152f5f14c6df3.jpg,$81,Small painted sage green curved side 5 drawer chest
https://pf-online-inventory-images.s3.us-west-1.amazonaws.com/online/dahdqah2/ae05fe2e828044a987a4c1cd3835d910.jpg,$280,Zentique Maison queen size wood frame & beige fabric camelback panel headboard 
https://pf-online-inventory-images.s3.us-west-1.amazonaws.com/online/cdgbapne/8d47f6070e624de58f90fdc7223cfe43.jpg,$208,Orange and white finish wood 3 drawer nightstand 
https://pf-online-inventory-images.s3.us-west-1.amazonaws.com/online/vie0rc11/89af6439b42d4ea0998e11550a185dab.jpg,$271,Narrow maple veneer 8 drawer chest with frosted glass accent
https://pf-online-inventory-images.s3.us-west-1.amazonaws.com/online/gzy1g1u3/6edc3f2e8cf542a3b09942e0af8f3492.jpg,$33,Children's shell bentwood chair with chrome legs
https://pf-online-inventory-images.s3.us-west-1.amazonaws.com/online/2aetl3ir/ad3668e0c39f4b13819e554006da12fd.jpg,$90,Vintage cherry kidney shaped vanity brass candelabra oval mirror & oval embroidered stool
https://pf-online-inventory-images.s3.us-west-1.amazonaws.com/online/yqx3t43k/4f9468b4ed2e4fcf8b14c3bc58317345.jpg,$33,"Small gold finish wood, glass and mirrored art deco style 1 door accent cabinet"
https://pf-online-inventory-images.s3.us-west-1.amazonaws.com/online/pj1p2kvh/223686c215c2487d8c654a0f1ca3eef8.jpg,$119,"Cherry finish wood 7 drawer, 2 door lift top jewelry armoire"
https://pf-online-inventory-images.s3.us-west-1.amazonaws.com/online/v4ua2elw/6d5bb3fa19df495c86389676516a13a1.jpg,$613,Diane natural ash wood 6 drawer dresser with cane accents
https://pf-online-inventory-images.s3.us-west-1.amazonaws.com/online/04nuk0zu/f1d63dc98f7348da978f6c83272a3dcb.jpg,$542,Amanda walnut finish wooden 6 drawer dresser with built-in handles 
https://pf-online-inventory-images.s3.us-west-1.amazonaws.com/online/htpoi31u/3a33bd8fe62a448c821d2cbcadfd13fe.jpg,$423,Demosthenes espresso finish wood 5 drawer chest
https://pf-online-inventory-images.s3.us-west-1.amazonaws.com/online/hxdf2vf3/fc8674d844214b4c96cb67f956a06ab3.jpg,$470,Williams walnut finish wood mid mod style 7 drawer dresser
https://pf-online-inventory-images.s3.us-west-1.amazonaws.com/online/sk1zqgca/125a70f3e52245afa8e02e438d7444ba.jpg,$556,Ishaque natural oak finish 6 drawer dresser w/ fluted drawer fronts & rounded edges
https://pf-online-inventory-images.s3.us-west-1.amazonaws.com/online/qewx4ktk/48aa7ab39f0a46f19bf0fe2d6b10143d.jpg,$233,Lane Alta Vista walnut mid century modern cedar lined storage chest - No key!
https://pf-online-inventory-images.s3.us-west-1.amazonaws.com/online/a14vg42s/f78f862e18c24808b95a5ac03d254b7c.jpg,$285,Kiral Nightstand by Sun at Six
https://pf-online-inventory-images.s3.us-west-1.amazonaws.com/online/tkgqp5hj/aa126be4c0b744ad9aca406227b9ae2b.jpg,$1378,"Kiral Bed, Nude, Queen platform bedstead "
https://pf-online-inventory-images.s3.us-west-1.amazonaws.com/online/wt5hn1ku/488db26bbadd4cc3ae06eb1b6bb0c35b.jpg,$375,Klinger California king light grey finish wood honeycomb design bedstead
https://pf-online-inventory-images.s3.us-west-1.amazonaws.com/online/yb2jwp3d/e0e8bc375cd846d089605a55b1b8824a.jpg,$532,"Jacklin 6 drawer 40"" solid wood chest"
https://pf-online-inventory-images.s3.us-west-1.amazonaws.com/online/mv5n0n5g/61782166059c42c994b57cd87fab67be.jpg,$63,Grey finish wood 2 drawer nightstand with mirror accents
https://pf-online-inventory-images.s3.us-west-1.amazonaws.com/online/wmvdylab/080fb8e925654b38bdf0db3ef4d62ac4.jpg,$90,"Vintage Ethan Allen dark pine 3 drawer, 1 door chest with white porcelain knobs"
https://pf-online-inventory-images.s3.us-west-1.amazonaws.com/online/c4aexw1s/5f7a877e8d7b430ba7bcc0d6069c3913.jpg,$90,"Rustic pine 1 drawer, 1 door nightstand with metal rivet accents"
https://pf-online-inventory-images.s3.us-west-1.amazonaws.com/online/zbaftjwy/331580872cf34bddae9b36dc7ea352d3.jpg,$500,Hispania Home London king size white velvet bedstead w/ extended headboard 
https://pf-online-inventory-images.s3.us-west-1.amazonaws.com/online/4niqbtam/19fc2444e29047a99e833bc73445c350.jpg,$375,Gabby Linnea brushed blonde finish solid oak 2 drawer nightstand 
https://pf-online-inventory-images.s3.us-west-1.amazonaws.com/online/dv2lui4t/14a3e1f541f3455b88a11f33ca747f3d.jpg,$309,Jaiyda dark grey finish wood 5 drawer dresser with antique gold accents 
https://pf-online-inventory-images.s3.us-west-1.amazonaws.com/online/dxj4cayi/9710bb4fac794bde809c7365cf10783b.jpg,$565,Mazlum whitewashed solid mango wood hand carved floral design 6 drawer chest
https://pf-online-inventory-images.s3.us-west-1.amazonaws.com/online/uz4rbby2/d966d2b157c4412e94d8bbe7db59770c.jpg,$214,Green and cream painted wood 1 door wardrobe with gold floral accents and key
https://pf-online-inventory-images.s3.us-west-1.amazonaws.com/online/hrbrgywg/69b66f148aad403c8b3735a47a5cc4a1.jpg,$150,Silver finish wood & grey tufted velvet queen size headboard w/ glitter & lighting
https://pf-online-inventory-images.s3.us-west-1.amazonaws.com/online/cfkjrfaz/d40a269c24b54b49b760e2240ffdd653.jpg,$95,Kayoko queen size acacia wood herringbone design headboard only - As is!
https://pf-online-inventory-images.s3.us-west-1.amazonaws.com/online/zxlzz52i/07501369f35240feabb0cc5c6c936d34.jpg,$1076,Bernhardt Prado grey oak finish 5 drawer chest w/ textured cast aluminum drawer fronts.
https://pf-online-inventory-images.s3.us-west-1.amazonaws.com/online/yruzm4mx/ae2bf3ef72e6452f9a735ef46587233f.jpg,$508,Espresso finish wood 6 drawer double dresser with fluted legs
https://pf-online-inventory-images.s3.us-west-1.amazonaws.com/online/gv3uvewc/acb8b2e6b0d7490d83ec88444eed1e2f.jpg,$1076,Bernhardt Normandie Manor grey wood and dimensional faux concrete 5 drawer chest
https://pf-online-inventory-images.s3.us-west-1.amazonaws.com/online/usr1j1jh/d4ed7464395d4e5ba411f1400f2fc2bf.jpg,$188,Vintage Dillingham Mfg mahogany cedar lined storage chest - No key!
https://pf-online-inventory-images.s3.us-west-1.amazonaws.com/online/2r0cnjt3/dbfce22013614f7e932881cf59158ab7.jpg,$716,"Walnut finish wood mid century 6 drawer dresser w/ 2 mirrors, armoire & 2 nightstands"
https://pf-online-inventory-images.s3.us-west-1.amazonaws.com/online/tdqrmblb/d804863eb04346e6a47b87f5ba87ef27.jpg,$233,Mitchell Gold & Bob Williams wood and chrome 1 drawer nightstand w/ glass top
https://pf-online-inventory-images.s3.us-west-1.amazonaws.com/online/vlmqkuf1/65dfb76594344a7aa3acc18d4a4db0f2.jpg,$675,Mitchell Gold & Bob Williams wood and chrome 8 drawer dresser w/glass top 
https://pf-online-inventory-images.s3.us-west-1.amazonaws.com/online/bdypjaoj/8b698dde0db7491085c5a0fa9cac3dd8.jpg,$591,"Cretys modern white lacquer & walnut wood veneer 4 drawer, 1 door dresser w/ glass top"
https://pf-online-inventory-images.s3.us-west-1.amazonaws.com/online/qtw1qdz4/ee8c948748c441dd8bbeae2491c65495.jpg,$336,Elin natural finish wood 3 drawer chest
https://pf-online-inventory-images.s3.us-west-1.amazonaws.com/online/0z54bc5t/39baa63f540d4205944ab353c81802fe.jpg,$761,William Switzer Napoli cherry finish wood bow front 3 drawer chest
https://pf-online-inventory-images.s3.us-west-1.amazonaws.com/online/nqoez42x/c1e3023855c642acb38f56afda3dd00f.jpg,$93,Ashley Casa Mollino round scalloped edge cherry finish wood nightstand w/ stone top 
https://pf-online-inventory-images.s3.us-west-1.amazonaws.com/online/hdixmxkn/41236d5d82684c28bf8d22f1f0992f4b.jpg,$395,Elin navy blue 3 drawer chest with gold circular handles 
https://pf-online-inventory-images.s3.us-west-1.amazonaws.com/online/ifvrlncw/5fa845c601484ce9a24b5640f3bba7c7.jpg,$361,Hetton distressed taupe finish wood 8 drawer double dresser
https://pf-online-inventory-images.s3.us-west-1.amazonaws.com/online/tkjmujqd/c3d2f2eccc944b5882552b4328e10d87.jpg,$404,Maxine oak finish wood 8 drawer dresser w/ gold metal base & round knobs
https://pf-online-inventory-images.s3.us-west-1.amazonaws.com/online/lyyvudex/41d47908bbc9429baab4205de45d3c68.jpg,$718,Freshford cedar log 6 drawer dresser
https://pf-online-inventory-images.s3.us-west-1.amazonaws.com/online/gawodkho/9e53cef02c1a4815a07298ec85f59382.jpg,$251,Astoria Grand Bathild ornate dark walnut finish 2 drawer nightstand with gold accents 
https://pf-online-inventory-images.s3.us-west-1.amazonaws.com/online/wrgsavw5/cb936bd9d9934854a0ab33090eaccd41.jpg,$166,Vintage painted grey and sage wardrobe without doors
https://pf-online-inventory-images.s3.us-west-1.amazonaws.com/online/vm1vfnvu/bc71d2fbc6b34e3381a58e6b2d9e2a12.jpg,$251,Malinda Haley Ivory fabric & Resin cane king size platform bed - As is Cane Damaged
https://pf-online-inventory-images.s3.us-west-1.amazonaws.com/online/2ox0ybvd/56331b1aa64b41c5a2ee89685aacde57.jpg,$846,Villa & House Ming Regency Sage Grasscloth Chow 4 Drawer Dresser
https://pf-online-inventory-images.s3.us-west-1.amazonaws.com/online/tk4db2wp/5eec09bddabb4a56a58b6eaa90f5eef6.jpg,$73,Vintage walnut finish wood and ornate molded plastic 2 drawer nightstand
https://pf-online-inventory-images.s3.us-west-1.amazonaws.com/online/qnseqshr/5c356862ed4d4afd98e3da7fe77e3a54.jpg,$463,Marguerite cream finish wood 6 drawer double dresser
https://pf-online-inventory-images.s3.us-west-1.amazonaws.com/online/ic15ikq4/83b648645ef446a3b9e0dce0bc6aa19b.jpg,$175,Geneva king size tan fabric panel headboard only
https://pf-online-inventory-images.s3.us-west-1.amazonaws.com/online/q0nf2ah3/df0507e70c5e4e0fa4d58d506b5a30c1.jpg,$76,Square light wood and ivory & green ribbon print fabric vanity stool
https://pf-online-inventory-images.s3.us-west-1.amazonaws.com/online/egamouen/aa5d03caa18f478eb413f71781823d13.jpg,$76,Distressed honey pine veneer 2 drawer nightstand 
https://pf-online-inventory-images.s3.us-west-1.amazonaws.com/online/wpv2ii44/d1050dee6e3847b5b08f66bb1de34d43.jpg,$1012,Noir Morten French Country Whitewash Mahogany Wood 9 Drawer Dresser
https://pf-online-inventory-images.s3.us-west-1.amazonaws.com/online/vpqtb1z4/5692a21b729c4754b0b61306915b31b3.jpg,$196,Vienna Rustic Lodge Grey Wood 1 Drawer Nightstand with Marble Top
https://pf-online-inventory-images.s3.us-west-1.amazonaws.com/online/yvlzykl4/55277705556748abb778b0982cd59bfc.jpg,$206,Homestead House Touchstone brown wood chinoiserie design 2 drawer chest w/ gold accents
https://pf-online-inventory-images.s3.us-west-1.amazonaws.com/online/jm5owr4e/30b81c0eb8ad4c9f9b3ec2851f7b3df6.jpg,$296,Drexel black lacquer wood chinoiserie design 3 drawer chest with gold accents
https://pf-online-inventory-images.s3.us-west-1.amazonaws.com/online/nt2nqntb/8eae443df6ad4aac9f14bd791ba65379.jpg,$94,Vintage mahogany 3 drawer nightstand w/ harlequin design front & green slate top
https://pf-online-inventory-images.s3.us-west-1.amazonaws.com/online/2ws3bgh1/1e6f517499b648b3bc22baf7f0590630.jpg,$394,Simon White Faux Shagreen Resin Brushed Gold Metal 3 Drawer Nightstand
https://pf-online-inventory-images.s3.us-west-1.amazonaws.com/online/r05t2ltj/73cc251e049547b783509c4debe6785b.jpg,$175,Nativa Interiors Moyra king size beige fabric panel headboard only 
https://pf-online-inventory-images.s3.us-west-1.amazonaws.com/online/dihbxgpa/5fd9ee3ec7634d018cd2947dfa5d8d22.jpg,$125,Christie glossy white finish wood and faux leather queen size low profile platform bed
https://pf-online-inventory-images.s3.us-west-1.amazonaws.com/online/4btbj433/9b276bf9bcdc4472bb344e30b46d014a.jpg,$371,Marino white 6 drawer double dresser with gold metal base
https://pf-online-inventory-images.s3.us-west-1.amazonaws.com/online/o0q0tem3/925d120355534c779155530919f35691.jpg,$172,The Prospect 1 drawer nightstand in oak
https://pf-online-inventory-images.s3.us-west-1.amazonaws.com/online/cwv1qoui/fc2233a7f2f54372bb7e45e014919bf6.jpg,$221,Hooker Furniture Traditions king size dark finish wood & beige fabric headboard only
https://pf-online-inventory-images.s3.us-west-1.amazonaws.com/online/z23hw1mq/29efd34cde964b1aa9ce1f8a07948fde.jpg,$45,Charcoal finish wood California king size panel headboard only
https://pf-online-inventory-images.s3.us-west-1.amazonaws.com/online/xsrexrov/f4a0cb965e634bd09cf1a93dc6118293.jpg,$109,Walnut finish wood king size mid mod style headboard only
https://pf-online-inventory-images.s3.us-west-1.amazonaws.com/online/2dyvezi5/4efc1fc55629479dae297a75a0b3b54a.jpg,$59,Brown finish wood king size panel headboard only
https://pf-online-inventory-images.s3.us-west-1.amazonaws.com/online/qjdz24on/1fa4a23eea7c4753a7b24f1323823f65.jpg,$149,Pier 1 Imports silver finish wood mirrored queen size bedstead with metal rails
https://pf-online-inventory-images.s3.us-west-1.amazonaws.com/online/w2bevrtl/8a83ee2093c9404daacf63427d5357c5.jpg,$95,Safavieh Couture queen size ivory boucle fabric headboard only
https://pf-online-inventory-images.s3.us-west-1.amazonaws.com/online/rpby35sb/f6363f2132e74ebeaf0c4c963b0d5658.jpg,$296,Rust and brown pattern fabric waterfall bench with curved sides
https://pf-online-inventory-images.s3.us-west-1.amazonaws.com/online/wv2ispy2/27b64986c1cd41e19cbdde9120909215.jpg,$766,Tommy Bahama Home Los Altos Tangiers oak finish 4 drawer hall chest w/ animal design
https://pf-online-inventory-images.s3.us-west-1.amazonaws.com/online/dsfk0noc/40bc6de509774bb8897737fd75319561.jpg,$206,Large cherry finish wood bench with blue fabric cushioned seat - Each
https://pf-online-inventory-images.s3.us-west-1.amazonaws.com/online/ujior4wm/d61b944ac4cc4743ac5aa83bec2f6873.jpg,$696,"Rowan Fully Upholstered  queen Canopy Bed
Extra deliery time needed with extra charge"
https://pf-online-inventory-images.s3.us-west-1.amazonaws.com/online/xeeotglf/87f02e7a80204aa8a9a15f019f649341.jpg,$346,Williams 2 tone cherry and white wood mid mod style 4 drawer chest with pull out tray
https://pf-online-inventory-images.s3.us-west-1.amazonaws.com/online/l2aeppjg/328897b96f2c401eb0eeb994f732a654.jpg,$245,Room & Board Kenwood grey finish wood 2 drawer nightstand w/ stainless steel legs
https://pf-online-inventory-images.s3.us-west-1.amazonaws.com/online/hvja5isb/68d966b4060543b8b674b6f210c0dd8e.jpg,$486,Tommy Bahama Ocean Breeze Brantley white solid wood 2 drawer oversized bachelors chest
https://pf-online-inventory-images.s3.us-west-1.amazonaws.com/online/g1tu1rnt/e30df6f516b14259ade38909c2750977.jpg,$127,Vintage Ethan Allen maple twin bedstead w/ pull out bed - Free used mattresses included
https://pf-online-inventory-images.s3.us-west-1.amazonaws.com/online/zhnsdpg5/8b121fadfe6542508506431a7afdff78.jpg,$488,Bernhardt Goodman rustic grey and white 6 drawer dresser. 1st Floor Only!
https://pf-online-inventory-images.s3.us-west-1.amazonaws.com/online/cuy2p5ya/38f8b70ea7ce47af9597c9eb4f792d4a.jpg,$257,Bernhardt pecan finish bow front 3 drawer nightstand w/ marble top
https://pf-online-inventory-images.s3.us-west-1.amazonaws.com/online/h5ra42ts/5d2e398c99c64d69adba898005ab994c.jpg,$211,Bernhardt Goodman rustic grey and white 1 drawer nightstand
https://pf-online-inventory-images.s3.us-west-1.amazonaws.com/online/lkvuniit/80f007ffdc79402ebe7a50db9bb55e16.jpg,$302,Layla Grace mint green wood 4 drawer chest with geometric designs
https://pf-online-inventory-images.s3.us-west-1.amazonaws.com/online/5cztnk0f/bb77cd097f374039ae2a15f3ca8ff39e.jpg,$895,"Bernhardt Blanca 4 drawer dresser, glass and Chrome, heavy, first floor only"
https://pf-online-inventory-images.s3.us-west-1.amazonaws.com/online/ayegncok/8ee2ca043248420eaed0c15fd0a2c1a6.jpg,$147,"Antique mahogany 1 drawer, 2 door wash stand "
https://pf-online-inventory-images.s3.us-west-1.amazonaws.com/online/gyysqmhh/a84521fba8c84e80b9821c9db0291a2c.jpg,$295,Lavelle California King curved ornate ivory wood and tufted velvet wingback headboard
https://pf-online-inventory-images.s3.us-west-1.amazonaws.com/online/4whujrnq/f2bbc3e8a0b049b0ab5d274d9287d411.jpg,$297,Woodbridge Furniture Ramsey tan solid oak 1 drawer nightstand w/ 2 open shelves
https://pf-online-inventory-images.s3.us-west-1.amazonaws.com/online/q3lmrxa2/0004195a27bf4bae95d759d435f110e4.jpg,$58,Vintage Ethan Allen maple 1 drawer nightstand with open storage 
https://pf-online-inventory-images.s3.us-west-1.amazonaws.com/online/w3oie0zy/db3713ba2d5247be99cf37653378bf76.jpg,$272,Bernhardt Sawyer light grey fabric king size panel bedstead
https://pf-online-inventory-images.s3.us-west-1.amazonaws.com/online/hzxiskrk/7a148073deee4ac0939c7f3786510579.jpg,$96,Ashley Furniture Brinxton charcoal pine veneer king size headboard 
https://pf-online-inventory-images.s3.us-west-1.amazonaws.com/online/ff0nsdvj/2c610b9535054d4d9fb6fb2642b91213.jpg,$107,Chenell white finish wood king size headboard 
https://pf-online-inventory-images.s3.us-west-1.amazonaws.com/online/zwh3yvt2/93c06769206a41c9a59ac3ce2ac7d167.jpg,$107,Angalee king size rattan headboard 
https://pf-online-inventory-images.s3.us-west-1.amazonaws.com/online/1z1zcour/8bb3b89a896f48a3a6ada8caa851aa73.jpg,$217,Hooker Furniture Archivist pecan finish wood 3 drawer nightstand
https://pf-online-inventory-images.s3.us-west-1.amazonaws.com/online/lbr3dtms/f6dcad86ac0441dfaa325f6af0355677.jpg,$175,ART Furniture Stockyard king size oak finish wood panel headboard 
https://pf-online-inventory-images.s3.us-west-1.amazonaws.com/online/s2bpee05/b5422275555247e48a3d06acb9f496da.jpg,$125,Irina full size mahogany finish wood panel headboard
https://pf-online-inventory-images.s3.us-west-1.amazonaws.com/online/q25itlae/45eb4cee3b4a4c72b57b17335e94837b.jpg,$212,Ralphio walnut finish live edge style 4 drawer chest
https://pf-online-inventory-images.s3.us-west-1.amazonaws.com/online/ekay24je/0d78b431350c46debb770a27de93ab6a.jpg,$195,Dakia grey sintered stone top extendable dining table w/ black steel base - As Is
https://pf-online-inventory-images.s3.us-west-1.amazonaws.com/online/g5wrfsgw/115565cd1779435f9b4d119a21193f0f.jpg,$22,"Vintage dark wood 2 drawer nightstand - As Is, top scratched"
https://pf-online-inventory-images.s3.us-west-1.amazonaws.com/online/cskkraze/3bf8d1fc982b42a0ad5ba76318ebb778.jpg,$42,Vintage dark oak 2 door nightstand with glass top
https://pf-online-inventory-images.s3.us-west-1.amazonaws.com/online/40tn0ouq/0dadd728d2cc43538f3529194ddec621.jpg,$145,Weybossett rectangular lift top sienna oak finish coffee table with storage 
https://pf-online-inventory-images.s3.us-west-1.amazonaws.com/online/pwh4akp0/b69957623d484e6da0c260e4b6866c18.jpg,$395,Claycomb dark brown flax leather rolled arm loveseat w/ nailhead trim & 2 accent pillows
https://pf-online-inventory-images.s3.us-west-1.amazonaws.com/online/kfazv3tw/f9b0a237ab1c4aabbd109c9093436c23.jpg,$716,International Furniture Direct Sedona dark brown faux leather & wood frame sofa w/
https://pf-online-inventory-images.s3.us-west-1.amazonaws.com/online/3jbbhfzw/79f86b7c3ae14fb4bf1afacfe280eafc.jpg,$295,Rowe Furniture sage green fabric square arm sofa w/ reversible cushions & 2 throw pillows
https://pf-online-inventory-images.s3.us-west-1.amazonaws.com/online/u0yk2a3y/04d25242536a460a9f9279049a3bb0a0.jpg,$245,"Modern grey corduroy corner chair w/ reversible back cushions & 1 throw pillow. As is, no"
https://pf-online-inventory-images.s3.us-west-1.amazonaws.com/online/leho43rj/f56c7a220c3640aa9597893cc2f71618.jpg,$295,"Modern blue fabric chaise lounge w/ reversible back cushion & 1 throw pillow. As is, no"
https://pf-online-inventory-images.s3.us-west-1.amazonaws.com/online/nkqmmhkn/50f1a6cca0db40b380c58c82f0021caf.jpg,$65,Tall square pale yellow bamboo Asian style side table with green and white tile inserts 
https://pf-online-inventory-images.s3.us-west-1.amazonaws.com/online/4fsyhcja/a37a90b23e6142c5a4a28b4653df2531.jpg,$595,Freeform monkey wood coffee table with black angled legs. Not guaranteed against cracking!
https://pf-online-inventory-images.s3.us-west-1.amazonaws.com/online/2ur14gm1/e5d7afb079d84de6b4b9ee0b7df7fa61.jpg,$695,Freeform monkey wood coffee table with block legs. Not guaranteed against cracking!
https://pf-online-inventory-images.s3.us-west-1.amazonaws.com/online/fvvlkfzp/d79b5bab5ee443bd84b5404fefa70409.jpg,$750,Freeform monkey wood coffee table with block legs. Not guaranteed against cracking!
https://pf-online-inventory-images.s3.us-west-1.amazonaws.com/online/feare5lm/611e8ff7e3774a5aaf49a2af3c452b89.jpg,$209,Round tree stump end table. Not guaranteed against cracking!
https://pf-online-inventory-images.s3.us-west-1.amazonaws.com/online/ppivw505/40537285916c4cca880649b3d8a9a5bd.jpg,$209,Round tree stump end table. Not guaranteed against cracking!
https://pf-online-inventory-images.s3.us-west-1.amazonaws.com/online/f31ripj3/2efb131d50544ccbaa1dfe353e4812f9.jpg,$425,Small freeform monkey wood console with bowtie accents. Not guaranteed against cracking!
https://pf-online-inventory-images.s3.us-west-1.amazonaws.com/online/peylpwwt/1a5757eb68a047d8bed68a92aa6eb073.jpg,$395,Small freeform monkey wood console. Not guaranteed against cracking!
https://pf-online-inventory-images.s3.us-west-1.amazonaws.com/online/4taaezjf/de94d111766a40b8800b14aff3a60d0f.jpg,$395,Small freeform monkey wood console. Not guaranteed against cracking!
https://pf-online-inventory-images.s3.us-west-1.amazonaws.com/online/irvkzdbw/ad929a262d8f4f08bcbc70e58bff2039.jpg,$395,Small freeform monkey wood console. Not guaranteed against cracking!
https://pf-online-inventory-images.s3.us-west-1.amazonaws.com/online/igruellt/dcd06e065f454ab2afdcc888cb52eca2.jpg,$225,Aspenhome contemporary alder media console with open geometric shelving
https://pf-online-inventory-images.s3.us-west-1.amazonaws.com/online/huke05nc/b8daf8552bd84d2690ff8e42aaaaae59.jpg,$795,Toronto beige fabric foam & down filled 2 piece sectional sofa w/ chaise end & reversible
https://pf-online-inventory-images.s3.us-west-1.amazonaws.com/online/i0spvduv/9f3e2f010269474b970fafd2da9e4d80.jpg,$595,Monkey wood coffee table with slab legs. Not guaranteed against cracking!
