image_url,price_text,image_title
https://pf-online-inventory-images.s3.us-west-1.amazonaws.com/online/uhea0pa0/c5adf89b7d854995940323ceebcb4fd6.jpg,$245,Round monkey wood hourglass shape stool w/ bowtie accent. Not guaranteed against cracking!
https://pf-online-inventory-images.s3.us-west-1.amazonaws.com/online/xrzwgpru/dd78476d41014bc6bc1eecfea411d07a.jpg,$225,Short square monkey wood spiral end table/ stool. Not guaranteed against cracking!
https://pf-online-inventory-images.s3.us-west-1.amazonaws.com/online/nbeovcoj/db8c046076514fb6ad1dc432d885e95f.jpg,$225,Square monkey wood wavy end table/ stool. Not guaranteed against cracking!
https://pf-online-inventory-images.s3.us-west-1.amazonaws.com/online/skxzhg5f/2512e67bbb2845caa9b6b09f4db76a06.jpg,$225,Square monkey wood wavy end table/ stool. Not guaranteed against cracking!
https://pf-online-inventory-images.s3.us-west-1.amazonaws.com/online/5cp1nrdp/be3c6ecb43794b2a8897e2e21d892590.jpg,$225,Square monkey wood wavy end table/ stool. Not guaranteed against cracking!
https://pf-online-inventory-images.s3.us-west-1.amazonaws.com/online/t4bvetgv/36dc8cac25d8451e99de470ad032d580.jpg,$245,Square monkey wood spiral end table/ stool. Not guaranteed against cracking!
https://pf-online-inventory-images.s3.us-west-1.amazonaws.com/online/1dv52v5b/81f80db5911e445abf7a91252c661ef5.jpg,$945,Freeform monkey wood console. 1st Floor Only! Not guaranteed against cracking!
https://pf-online-inventory-images.s3.us-west-1.amazonaws.com/online/dn2gczlu/4ff524433e27413d84dbc4c4c8e522cd.jpg,$895,Freeform monkey wood console. 1st Floor Only! Not guaranteed against cracking!
https://pf-online-inventory-images.s3.us-west-1.amazonaws.com/online/mmjpqw1v/088beaaa4bc949c1890437ab2fb2f696.jpg,$750,Freeform monkey wood console. 1st Floor Only! Not guaranteed against cracking!
https://pf-online-inventory-images.s3.us-west-1.amazonaws.com/online/t0x4xgpt/491ad935f8014ec7a28e7d799c53f3d6.jpg,$695,Freeform monkey wood console. 1st Floor Only! Not guaranteed against cracking!
https://pf-online-inventory-images.s3.us-west-1.amazonaws.com/online/ljdqaclz/3a742c9358874eb7b1e8b25d4681046d.jpg,$795,"Kai white & tan mango wood hall tree w/ bench, coat hooks & 3 shoe storage drawers"
https://pf-online-inventory-images.s3.us-west-1.amazonaws.com/online/k3mxmkbq/eeb9af50d8e74bfb9402cc0fbe4bb66e.jpg,$345,"BDI Dino triangular tinted glass, stone & black metal base coffee table"
https://pf-online-inventory-images.s3.us-west-1.amazonaws.com/online/2tmvbcqe/8a012caf79d947569603fdb04cb1acd6.jpg,$145,"Inside Weather round latte coffee table w/ grey marble, black & gold geometric design top"
https://pf-online-inventory-images.s3.us-west-1.amazonaws.com/online/cypnjjdj/8e06b64ab8dc490faf891c26a358b04b.jpg,$495,Sylvia grey finish solid mango wood drum coffee table with storage
https://pf-online-inventory-images.s3.us-west-1.amazonaws.com/online/tw4iiyih/79ee34c6d0ba4c268b5e110a102e5474.jpg,$450,Skylar black genuine leather and iron base bench
https://pf-online-inventory-images.s3.us-west-1.amazonaws.com/online/kxbzcmtm/bf1dc7844ab349628f78af5a73c6a8d9.jpg,$745,Gemi blue fabric square arm full size sleeper sofa w/ reversible cushions
https://pf-online-inventory-images.s3.us-west-1.amazonaws.com/online/snbmfkxk/cd16eb5397f948d98b6be4a37b5c34a3.jpg,$595,Bradington-Young Taraval teal leather wingback chair w/ brad trim & espresso wooden legs
https://pf-online-inventory-images.s3.us-west-1.amazonaws.com/online/a0tg2xcz/d86eba8ca3ff4fd5964934c7e985065c.jpg,$495,Lexington Bob Timberlake Arts & Crafts Collection cherry wood 1 drawer sofa table
https://pf-online-inventory-images.s3.us-west-1.amazonaws.com/online/a4sfypzd/fb376ae79496470f8282130face7b6e7.jpg,$795,Jonathan Louis red chenille 4 piece square arm curved sectional w/ reversible cushions
https://pf-online-inventory-images.s3.us-west-1.amazonaws.com/online/nuxnvism/7a969744f8d34d56914b98d1593bad26.jpg,$693,Urbia Ie Series 71'' Oak Wood Burl Vintage Copper Sideboard
https://pf-online-inventory-images.s3.us-west-1.amazonaws.com/online/2w1pk2qj/fa81daf353344ff48464ff495856d2d3.jpg,$32,"Round cherry finish wood pedestal side table - As is, scratches "
https://pf-online-inventory-images.s3.us-west-1.amazonaws.com/online/vefp4epf/6c7a211253b04862990f818cd8c98e72.jpg,$295,Salamander Designs dark walnut and black glass 3 door media console
https://pf-online-inventory-images.s3.us-west-1.amazonaws.com/online/oq1e3zgs/dd56dae9ff904344bc3e52ab1ccc129d.jpg,$195,"Hotel Zeus by Ron Arad grey steel cone base TV stand w/ glass shelf on wheels, Italy"
https://pf-online-inventory-images.s3.us-west-1.amazonaws.com/online/241go3o3/efc9cc05ac9d49a88fab555699138b57.jpg,$145,Walnut veneer & metal modular wall shelf w/ drop down desk & record/ magazine organizer
https://pf-online-inventory-images.s3.us-west-1.amazonaws.com/online/hx4uzqzl/73420362395949b0888cbaba2cdcb2dd.jpg,$195,Heritage mahogany storage trunk with brass accents and key
https://pf-online-inventory-images.s3.us-west-1.amazonaws.com/online/53untief/1e46c6554f39474996cd8751224aeaab.jpg,$245,Rectangular low walnut finish wood and grey metal coffee table w/ movable glass shelf
https://pf-online-inventory-images.s3.us-west-1.amazonaws.com/online/u5bafo2v/1bdc0ec6ddca4dacb43e3c0ae3807803.jpg,$425,Designwright Studios cocoa velvet square arm club chair w/ tan chenille cushion & pillow
https://pf-online-inventory-images.s3.us-west-1.amazonaws.com/online/b2jeo4k1/62b7e39f06084a138830008395cdfdfd.jpg,$157,Rectangular black and gold Chinoiserie design coffee table 
https://pf-online-inventory-images.s3.us-west-1.amazonaws.com/online/vyxmrrvz/3ea86477fb884f1b974942ffc19124e4.jpg,$185,Set of 3 vintage Imperial black and gold finish wood Chinoiserie design nesting tables
https://pf-online-inventory-images.s3.us-west-1.amazonaws.com/online/a4lo2xnk/877477c755c44395bdf305fe5a099032.jpg,$1420,Braxton Culler Easton beige chenille square arm 2 pc sectional w/ rev cushions & 3 pillows
https://pf-online-inventory-images.s3.us-west-1.amazonaws.com/online/1vz5cjej/bc5e868d999c40bd9e7960f4f42e4ed5.jpg,$613,Plush navy blue faux fur home theater chaise lounge w/ 5 pillows & cup holders
https://pf-online-inventory-images.s3.us-west-1.amazonaws.com/online/scdndqz2/87d6a7e108fe4f96a7d86d56239100df.jpg,$1031,Maxwell Platinum Velvet Loveseat with 3 Pillows by Apartment Therapy
https://pf-online-inventory-images.s3.us-west-1.amazonaws.com/online/xrcgezj3/e38109f68f30467693fc9d70e198001a.jpg,$37,The Bombay Co. cherry finish wood Federal style 1 drawer scalloped edge console table
https://pf-online-inventory-images.s3.us-west-1.amazonaws.com/online/ce20xkfm/2babd207baa747dc9dc916a2dfeb48af.jpg,$71,Set of 4 light finish bentwood stacking stools/ stacking tables
https://pf-online-inventory-images.s3.us-west-1.amazonaws.com/online/lvchcawl/917b82f3d76a4b41b4a841905266743d.jpg,$37,Vintage Contemporary Shells round white metal & tan faux leather tulip swivel stool
https://pf-online-inventory-images.s3.us-west-1.amazonaws.com/online/d3qgbgls/f7e39680ec314029b6e0ab4c68889ffe.jpg,$71,"Pair of Calligaris Viva by Lucci & Orlandini mint green plastic & metal folding chairs, "
https://pf-online-inventory-images.s3.us-west-1.amazonaws.com/online/pfan0v1a/b3eb0b6b706e45d2b1954dfa63847ee2.jpg,$90,Pair of Sintesi Gogo by Marcello Ziliani round mint green plastic chairs w/ chrome legs
https://pf-online-inventory-images.s3.us-west-1.amazonaws.com/online/5dbi3cqf/11b69b8c7e124f7c872a39b87abfe2fd.jpg,$375,"Vintage children's rattan loveseat, 2 chairs w/ brass accents & cushions & coffee table  "
https://pf-online-inventory-images.s3.us-west-1.amazonaws.com/online/42shyn4p/5f14c307190e47c18167f4a83194cd5c.jpg,$86,Tambor Round Tan Boucle Ottoman
https://pf-online-inventory-images.s3.us-west-1.amazonaws.com/online/rjvwejsh/05f3fdf7d63c45f486d251e9b5a3e728.jpg,$300,Large rectangular black and gold Asian design 2 piece showcase coffee table w/ glass top
https://pf-online-inventory-images.s3.us-west-1.amazonaws.com/online/vjndt1o3/d816d693ec6c45d6b967300c68314a6e.jpg,$759,Janya black slatted 4 door media console 
https://pf-online-inventory-images.s3.us-west-1.amazonaws.com/online/20fsioll/cdbfb4eb42554efeaaf83d734388e6f3.jpg,$1040,Hanceville white finish wood and glass 4 piece media center w/ LED lighting
https://pf-online-inventory-images.s3.us-west-1.amazonaws.com/online/2ix5j1lj/79423e9c412e4506ac2b77e3d1409078.jpg,$660,Geo spice genuine leather tufted seat mid mod style sofa
https://pf-online-inventory-images.s3.us-west-1.amazonaws.com/online/s2b15m2i/a06704ac43a24dbfb3ec8ada1023863e.jpg,$280,Hooker Furniture Traditions round distressed white finish solid pine top coffee table
https://pf-online-inventory-images.s3.us-west-1.amazonaws.com/online/gb01wfps/0a62c7c228fd4326b241b2e65a0fdad6.jpg,$565,"Brigantine 95"" espresso finish wood 2 door TV stand w/ open storage & 2 glass shelves"
https://pf-online-inventory-images.s3.us-west-1.amazonaws.com/online/ojk4jeha/98d4f7ceada640638b883d7aaa38be5a.jpg,$157,Brown tufted leather armchair with brad trim
https://pf-online-inventory-images.s3.us-west-1.amazonaws.com/online/4mud3orj/2987430c48bd40418e73428212d6ab21.jpg,$151,Sofa table with tile top and 2 drawers 
https://pf-online-inventory-images.s3.us-west-1.amazonaws.com/online/vqbhn4d4/42c67e696b824566993c9b1c0924d4d7.jpg,$280,West branch novelty streamlined chest
https://pf-online-inventory-images.s3.us-west-1.amazonaws.com/online/kxqvmow3/ccb78bf3c33a4e4dbf6ddceb481b0180.jpg,$198,Large distressed gold finish wood frame & glass 2 tier coffee table w/ brass accents 
https://pf-online-inventory-images.s3.us-west-1.amazonaws.com/online/krngttyp/8781548c49e349139ca9512d92734285.jpg,$65,Latte wood round coffee table with flare espresso legs
https://pf-online-inventory-images.s3.us-west-1.amazonaws.com/online/jkclqtm4/5d257887cdd24f10a0f662f3638cf341.jpg,$81,Safavieh Palmer tufted beige ottoman with crossed legs and brad trim
https://pf-online-inventory-images.s3.us-west-1.amazonaws.com/online/s51fltsl/cc0bac0f69864d2385e92a3e9ed473e6.jpg,$48,Inside Weather navy blue side chair 
https://pf-online-inventory-images.s3.us-west-1.amazonaws.com/online/rezv4p2h/2a15c8a754824c5fa1ccf3c430cbc51e.jpg,$81,Safavieh Palmer orange fabric ottoman with crossed legs and brad trim
https://pf-online-inventory-images.s3.us-west-1.amazonaws.com/online/2syysbj3/01ba3996d3574707a3e711ee16b6c046.jpg,$75,Inside Weather Sarno Counter Stool in Black
https://pf-online-inventory-images.s3.us-west-1.amazonaws.com/online/zgsdzh3i/23fcdb86f1f446a3999d1a2402de9ade.jpg,$58,Inside Weather Nola armchair in gren
https://pf-online-inventory-images.s3.us-west-1.amazonaws.com/online/1a0yv4no/b0a67d543c924f25af3ee57642404573.jpg,$58,Inside Weather Nola armchair in grey
https://pf-online-inventory-images.s3.us-west-1.amazonaws.com/online/a50lvjdw/ad27d568cad24f738500354fbbeb2ba3.jpg,$58,Inside Weather Nola armchair in tan
https://pf-online-inventory-images.s3.us-west-1.amazonaws.com/online/jo3bppus/0752521ad17a4880aea8842814943b9b.jpg,$58,Inside Weather Nola armchair in teal
https://pf-online-inventory-images.s3.us-west-1.amazonaws.com/online/5fjfxmvc/d512bf5698614b7a8035c26712a1b928.jpg,$58,Inside Weather Nola armchair in navy blue
https://pf-online-inventory-images.s3.us-west-1.amazonaws.com/online/ozdnz5o0/f05402edb30949778d460eaf146d4af5.jpg,$58,Inside Weather Nola armchair in light blue
https://pf-online-inventory-images.s3.us-west-1.amazonaws.com/online/zgf5u2od/ffb2040d16144c8eaf7fe084f1917d88.jpg,$48,Inside Weather Nola Side Chair in Light Blue
https://pf-online-inventory-images.s3.us-west-1.amazonaws.com/online/jlccvnsu/da5a4d2576524966ba2db4bd21ad2731.jpg,$66,Inside Weather Nola Armchair in Onyx Faux Leather 
https://pf-online-inventory-images.s3.us-west-1.amazonaws.com/online/zniia1ju/9d56f2d95f7d424389573ae6d597f09a.jpg,$176,Bronze floor lamp with Jasper accents
https://pf-online-inventory-images.s3.us-west-1.amazonaws.com/online/bpckt1me/118aed1e924b4b51904d02058e9f0742.jpg,$185,Cochrane Furniture olive green chenille rolled arm loveseat w/ brad trim & 2 pillows
https://pf-online-inventory-images.s3.us-west-1.amazonaws.com/online/2jsz0jia/b931d13c9d0d4a008293f10da209c4d0.jpg,$660,Velarde cherry finish solid wood and glass 4 door media console w/ open storage
https://pf-online-inventory-images.s3.us-west-1.amazonaws.com/online/wuxbos0z/9892e212904d4367b6604577650c043d.jpg,$46,Children's brown faux leather chaise lounge
https://pf-online-inventory-images.s3.us-west-1.amazonaws.com/online/l0o331ws/94f331ccda45496bb6cbd5c6385911aa.jpg,$233,Inlaid cherry finish wood 2 door media console w/ electric fireplace & scroll metal accent
https://pf-online-inventory-images.s3.us-west-1.amazonaws.com/online/yz3qrlxi/f31c2ccf361c4930bb771c4251684576.jpg,$850,Lorenzo blue grey leather 2 piece power reclining sofa w/ adj headrests & black metal legs
https://pf-online-inventory-images.s3.us-west-1.amazonaws.com/online/yrtr4ovr/550473b85fcc44c4938c0b1191131592.jpg,$660,Foyzul ivory boucle fabric curved rolled arm Chesterfield sofa
https://pf-online-inventory-images.s3.us-west-1.amazonaws.com/online/zasmiec4/0f6a0556c22747a6bb485d48120e5b27.jpg,$33,Maple veneer pressed wood wavy shelf with light and 2 glass shelves
https://pf-online-inventory-images.s3.us-west-1.amazonaws.com/online/lraasiy1/b1383a44640d4d7ea01a21c3f1cca279.jpg,$850,Broyhill Sculptra Brutalist MCM 2 piece hutch 
https://pf-online-inventory-images.s3.us-west-1.amazonaws.com/online/bkwgmdpf/e4d064b0e6ea4efda3589afadc1ecb08.jpg,$233,"Catnapper brown faux leather rolled arm lift recliner w/ brad trim, heat/ massage & USB"
https://pf-online-inventory-images.s3.us-west-1.amazonaws.com/online/i5bqokvo/20094e35bb764103aec3e1f9dcfcd434.jpg,$252,Steve Silver George distressed oak wood frame 2 tone beige fabric & brown faux leather
https://pf-online-inventory-images.s3.us-west-1.amazonaws.com/online/asjakrbw/6487bda1b2a44c23980f6c9c89943909.jpg,$565,Yosel 2 tone white finish wood & rustic pine 2 door media console w/ electric fireplace &
https://pf-online-inventory-images.s3.us-west-1.amazonaws.com/online/1ystad3q/1cf53c5b1d5b4de4932cdb80a0aef2b4.jpg,$641,Hooker Furniture Serenity weathered grey wood and textured beige console table 
https://pf-online-inventory-images.s3.us-west-1.amazonaws.com/online/meczegua/a7257575b5e6480ab8d8de0a3945afaa.jpg,$499,Hooker Melange blue starburst design bow front 2 drawer accent chest w/ pewter metal legs
https://pf-online-inventory-images.s3.us-west-1.amazonaws.com/online/rffxikx2/2ebb02a33ca24b47aabe3c6bc0d39a95.jpg,$185,Round distressed light cherry finish wood side table with nailhead accents
https://pf-online-inventory-images.s3.us-west-1.amazonaws.com/online/yycowvzh/f72fbe90ff8944fd99bb2ce8ac8042f9.jpg,$233,"Carved wood frame and gold, green & red striped fabric high back armchair w/ brad trim"
https://pf-online-inventory-images.s3.us-west-1.amazonaws.com/online/hkv3tojr/c3c23f24de11491b948a239267e1bf9e.jpg,$380,Placida Round Wood Coffee Table with Triangle Shaped Legs
https://pf-online-inventory-images.s3.us-west-1.amazonaws.com/online/lvrc2br0/82f6e9457103406e92fc413c2cbc571b.jpg,$76,Vintage Mersman round painted white wood 1 drawer side table w/ embossed leather top
https://pf-online-inventory-images.s3.us-west-1.amazonaws.com/online/f3mikwz0/dc0f6060e3c047b3889a1dfebff8ef98.jpg,$58,Black metal and glass 3 tier TV stand 
https://pf-online-inventory-images.s3.us-west-1.amazonaws.com/online/x1y4mbrd/90630f72cd0c4d328f7f0580eb4174fe.jpg,$40,Rectangular cherry finish wood and faux marble top end table 
https://pf-online-inventory-images.s3.us-west-1.amazonaws.com/online/hnoth12h/881e07cc6f094b3c8c8e83cfc837a37e.jpg,$48,Square teak and tinted glass end table 
https://pf-online-inventory-images.s3.us-west-1.amazonaws.com/online/blxgvb3k/7af94a5ee0734477bb89869bf08aabfe.jpg,$176,Grey fabric armless chair with reversible cushions 
https://pf-online-inventory-images.s3.us-west-1.amazonaws.com/online/2hzhdiyi/87ec16b835294135abab23b868d65762.jpg,$446,Rafeef medium solid oak and glass 2 door media console with open storage 
https://pf-online-inventory-images.s3.us-west-1.amazonaws.com/online/dnemcomt/02b191f7d9ef4e2b95b89e566594dc12.jpg,$670,Black and gold wood chinoiserie 3 drawer console table w/ terracotta color marble top.
https://pf-online-inventory-images.s3.us-west-1.amazonaws.com/online/pg5qzjek/b6f99b1890014793898c18992b2fd450.jpg,$986,Astra blue fabric square arm 2 piece sectional sofa with chaise end and 2 pillows
https://pf-online-inventory-images.s3.us-west-1.amazonaws.com/online/dajh0qoj/aabe794724e749fa88147a48d6ba6eb9.jpg,$896,Hooker Furniture Melange dark wood 4 door media console w/ wavy grooved door fronts &
https://pf-online-inventory-images.s3.us-west-1.amazonaws.com/online/hvt22gbj/0811768927c04e08b3e40663c4a3c3ab.jpg,$220,Dark cherry finish wood and glass single panel door audio cabinet w/ 3 glass shelves
https://pf-online-inventory-images.s3.us-west-1.amazonaws.com/online/sdzfhpmm/1168db3d4e5d4863b456d184b3c84d7f.jpg,$140,"Mirrored X-shaped geometric console table w/ crystal embellishments - As is, crack "
https://pf-online-inventory-images.s3.us-west-1.amazonaws.com/online/rvtpyuz5/494fa648b7024687b1808195243712a0.jpg,$629,Ellahome black wrought iron triple diamond console table with white marble top
https://pf-online-inventory-images.s3.us-west-1.amazonaws.com/online/miihej0j/ec7b3792b17e4771a124c9319b1479a9.jpg,$176,Round dark finish tropical wood 1 drawer pedestal side table 
https://pf-online-inventory-images.s3.us-west-1.amazonaws.com/online/i3kdxk5a/99d5a8fa84594d25932ec95cc91b51f7.jpg,$356,Grey ash crossed leg coffee table w/ oval glass top & 1 end table w/ round glass top
https://pf-online-inventory-images.s3.us-west-1.amazonaws.com/online/yrijlxss/2db1d4dff33940fa93dffe24dcff314f.jpg,$130,"Modern rectangular dark wood, brushed nickel and glass end table"
https://pf-online-inventory-images.s3.us-west-1.amazonaws.com/online/njuavhqi/5ee4d2eb473c484cae1f1bb9e1d9d198.jpg,$446,"Abbyson Home Jimoh grey wood & black metal coffee table, console table & 2 end tables "
https://pf-online-inventory-images.s3.us-west-1.amazonaws.com/online/nhhjhhmt/2ef89dc7b0844567a32e74c31a4a1d53.jpg,$299,Blaris brown fabric and faux leather convertible sofa w/ woodgrain armrests & 2 pillows
https://pf-online-inventory-images.s3.us-west-1.amazonaws.com/online/f5njlpjn/b5d9d20015cf416d8a4b568b1e041f56.jpg,$176,Bridgnorth dark finish acacia wood 2 door media console with open storage 
https://pf-online-inventory-images.s3.us-west-1.amazonaws.com/online/g51c5qmw/4552d7783b404e658544f0752579f8a7.jpg,$130,Rectangular cherry finish wood & slate X-bottom coffee table & 1 end table w/ glass tops
https://pf-online-inventory-images.s3.us-west-1.amazonaws.com/online/dkbyknda/26c3551cacbd426da16ef58bfdbbb2e2.jpg,$417,Black Forest Decor brown microsuede & tweed sofa w/ brad trim & turquoise & silver accent
https://pf-online-inventory-images.s3.us-west-1.amazonaws.com/online/pmdsycaq/4c8e8eadfc494385a75ed6ac5d5e448d.jpg,$145,Arteriors Home Daisy Round Dove Grey & Taupe Lacquer Accent Table - Each
https://pf-online-inventory-images.s3.us-west-1.amazonaws.com/online/rrcwanfu/5a2ebbc90bcb4d28b34428907d108b41.jpg,$266,Vintage carved dark pine 2 door accent cabinet with spindle accents 
https://pf-online-inventory-images.s3.us-west-1.amazonaws.com/online/rwwm2yhf/810fa38dd4944455b4a0df05bb025103.jpg,$536,Lane gold fabric slope arm sofa and loveseat w/ reversible cushions & 4 pillows
https://pf-online-inventory-images.s3.us-west-1.amazonaws.com/online/1vv10zxe/6a3fa6e07bdd4e219063d5b1beffcb7c.jpg,$446,Hooker Furniture Chapman narrow distressed black finish wood console table
https://pf-online-inventory-images.s3.us-west-1.amazonaws.com/online/l0zwh5tx/6a15702d00d1407c846c174f6b4acb85.jpg,$446,Uttermost Cathryn solid wood accent chest with 6 wood storage baskets 
https://pf-online-inventory-images.s3.us-west-1.amazonaws.com/online/zy2xp42g/35527ff31c9e4f27b181ad95e1032e20.jpg,$225,Hercules Diplomat Series grey faux leather flare arm loveseat 
https://pf-online-inventory-images.s3.us-west-1.amazonaws.com/online/hbi4nsan/b5041782ac3f4b9a834d07bac34b1a38.jpg,$395,Set of 4 carved dark wood Asian style nesting tables 
https://pf-online-inventory-images.s3.us-west-1.amazonaws.com/online/ybj5vu3r/4c9bf327731b4c36bc09646cc4dd171f.jpg,$995,Avon ivory boucle fabric and tan leather wood frame lounge chair and ottoman
https://pf-online-inventory-images.s3.us-west-1.amazonaws.com/online/herctybd/2d7b277c7dcc44dbbe513efaf2b79bdf.jpg,$536,Arhaus railway coffee table
https://pf-online-inventory-images.s3.us-west-1.amazonaws.com/online/jo1vtfgi/0d2a6bfbf52a4b14a1360ed7153678a2.jpg,$248,Black showcase w sliding door
https://pf-online-inventory-images.s3.us-west-1.amazonaws.com/online/ykez2rea/0ba7edb6fe844b54851a83518d901bef.jpg,$248,Hoff Miller cherry wood frame & brown chenille arm chair w/ gold pattern cushions & brad
https://pf-online-inventory-images.s3.us-west-1.amazonaws.com/online/ucca4ffp/2432dbec4c844c63865fb95424a52152.jpg,$356,Antique oak and glass Art Deco style 1 door showcase with round brass accent & key
https://pf-online-inventory-images.s3.us-west-1.amazonaws.com/online/ngxxrpnp/d505730c4cdc4b5e88983cf1c561c82b.jpg,$413,Rustic cedar coffee table with iron spoke wheels and accents 
https://pf-online-inventory-images.s3.us-west-1.amazonaws.com/online/vcxj4zmg/0563c5f384b84eda8215e922a61eceae.jpg,$112,Aqua tweed fabric mid century modern swivel lounge chair on brown metal pedestal base
https://pf-online-inventory-images.s3.us-west-1.amazonaws.com/online/ehygwfvb/d4e964986dca4945a6d4d5c38b4ecb0d.jpg,$356,Walnut finish wood media cabinet with 2 lattice sliding doors
https://pf-online-inventory-images.s3.us-west-1.amazonaws.com/online/igsutn0p/74a0dd558a044d9ebe05630384a218d3.jpg,$395,Arteriors Underhill Square Coffee Table
https://pf-online-inventory-images.s3.us-west-1.amazonaws.com/online/lttfo1b5/246a4e04bfc045998a85c147c0d57abd.jpg,$139,World Market beige and dark wood Moroccan style storage trunk w/ red accents 
https://pf-online-inventory-images.s3.us-west-1.amazonaws.com/online/b3333oox/a22e0182a08c4119b22e582bdf4889c1.jpg,$506,Lidcombe cream fabric & black leather square arm chaise lounge w/ black metal legs &
https://pf-online-inventory-images.s3.us-west-1.amazonaws.com/online/p01m5znb/3eaef66d36a04f05b18cf02a81434e9c.jpg,$234,Rex rectangular caramel leather ottoman
https://pf-online-inventory-images.s3.us-west-1.amazonaws.com/online/dfb2dspp/3af9ac07da814582980da8b9a09d78b0.jpg,$506,Rex grey fabric 2 seater modular sofa
https://pf-online-inventory-images.s3.us-west-1.amazonaws.com/online/c0rdizmb/7833faa6e1934776b845f35683d6a2a3.jpg,$93,Cherry finish wood & black metal 3 tier 2 drawer TV stand with 1 black glass shelf
https://pf-online-inventory-images.s3.us-west-1.amazonaws.com/online/tzrjvq4x/d2be31aac54d4ed2a993252c3fb8ff47.jpg,$50,Purple checkered ottoman 
https://pf-online-inventory-images.s3.us-west-1.amazonaws.com/online/z5ulzqwq/403f4b733463415ba1edd61736e706e9.jpg,$123,Beige fabric square arm accent chair with silver brad trim 
https://pf-online-inventory-images.s3.us-west-1.amazonaws.com/online/nzs5awnn/013a01cb9c75402cb30d2a151c4508ae.jpg,$463,"Vail Dining Chair, Walnut, Boucle"
https://pf-online-inventory-images.s3.us-west-1.amazonaws.com/online/ygyb3yyk/f7ba2cddc0c149928478e86ccccb3673.jpg,$463,"Vail Dining Chair, Walnut, Boucle"
https://pf-online-inventory-images.s3.us-west-1.amazonaws.com/online/3hbcyopk/cfdf52a8ae484a81ad40a2ba7c606248.jpg,$463,"Vail Dining Chair, Walnut, Boucle"
https://pf-online-inventory-images.s3.us-west-1.amazonaws.com/online/v4r03a1c/c9ae228473f3439092fb5697f9bc0158.jpg,$463,"Vail Dining Chair, Walnut, Boucle"
https://pf-online-inventory-images.s3.us-west-1.amazonaws.com/online/cwdzttpx/0ceae9d7c4c446a692ce86d78da820d5.jpg,$463,"Vail Dining Chair, Walnut, Boucle"
https://pf-online-inventory-images.s3.us-west-1.amazonaws.com/online/403o0z1g/190c8af6c23340099335e20f97f91442.jpg,$545,"Vail Dining Chair, Walnut, Boucle"
https://pf-online-inventory-images.s3.us-west-1.amazonaws.com/online/agmvhk2s/5f3d47dd18374881839caed1dcc52aac.jpg,$336,Woodland Furniture half moon distressed honey finish & sage green wood console table
https://pf-online-inventory-images.s3.us-west-1.amazonaws.com/online/jsyzltxu/5e4e24e0da784381a5457a4d15605cfc.jpg,$591,19th century Louis XIV style carved mahogany wood frame & camel leather armchair
https://pf-online-inventory-images.s3.us-west-1.amazonaws.com/online/pjlo52dm/0cedb0d10db94571a300d4f351290cfe.jpg,$361,Wright Table Company rectangular dark oak 1 drawer side table
https://pf-online-inventory-images.s3.us-west-1.amazonaws.com/online/hlqzhrtn/6f69b756014444008a11d9682ae31625.jpg,$191,Cherry tray top style 1 drawer end table with curved legs
https://pf-online-inventory-images.s3.us-west-1.amazonaws.com/online/1ub5bsub/7fef826f96354b0da594ee78af793ce2.jpg,$390,Black and gold scroll iron trestle base console table with alder finish wood top
https://pf-online-inventory-images.s3.us-west-1.amazonaws.com/online/tiido1av/a0b6aacf5f7c4804b35fef31ba99edf4.jpg,$336,Painted rust faux patina 2 drawer curved leg accent chest with fern leaf accents
https://pf-online-inventory-images.s3.us-west-1.amazonaws.com/online/a5vrnhsz/639a2210b1e941a9a3ab658eb4bf2503.jpg,$390,Black and gold scroll iron trestle base console table with alder finish wood top
https://pf-online-inventory-images.s3.us-west-1.amazonaws.com/online/1flauuvi/dc888b5aea224f84ba3ae2855f652fce.jpg,$395,Rectangular distressed dark cherry finish coffee table with barley twist legs
https://pf-online-inventory-images.s3.us-west-1.amazonaws.com/online/liqir5eg/c5e48690e256470a9a7f7323887d3152.jpg,$378,Michael Taylor Designs organic shape wood side table
https://pf-online-inventory-images.s3.us-west-1.amazonaws.com/online/gluyzcgn/369676dd5d19440d823accc605205cc1.jpg,$378,Michael Taylor Designs organic shape wood side table
