image_url,price_text,image_title
https://pf-online-inventory-images.s3.us-west-1.amazonaws.com/online/e4rgz3hz/d65a9c4df9984789a914a83aa8e9dd0a.jpg,$98,Dark brown leather rolled arm accent chair
https://pf-online-inventory-images.s3.us-west-1.amazonaws.com/online/dzbmsjmd/950ef1a274d147b7b6e83334a1876dd8.jpg,$645,Primitive red paint Carpenters workbench
https://pf-online-inventory-images.s3.us-west-1.amazonaws.com/online/5grk5odd/1992d2852feb457986f3d2ea573b6265.jpg,$248,"Modern long, low glossy black and white finish wood 4 drawer TV console "
https://pf-online-inventory-images.s3.us-west-1.amazonaws.com/online/eaestzw1/1ede14c6d286435dbc164c26f3918d22.jpg,$750,White washed wood wagon wheel covered bench with leather seats
https://pf-online-inventory-images.s3.us-west-1.amazonaws.com/online/x4qnfb4i/6b5d34afb3fd4523a9e6b87a36e7fdac.jpg,$298,Antique oak hall tree with diamond shaped mirror and floral tile accents 
https://pf-online-inventory-images.s3.us-west-1.amazonaws.com/online/rfsc9gox/77e535e838714b30a2f992a00184e758.jpg,$995,Antique carved oak concave front curio cabinet with 1 glass door
https://pf-online-inventory-images.s3.us-west-1.amazonaws.com/online/pqbm5pom/046de072ec2a442e9eb5ba0819f4ccec.jpg,$174,Parkey whitewashed wood 2 door accent cabinet w/ faux snakeskin and gold iron base
https://pf-online-inventory-images.s3.us-west-1.amazonaws.com/online/idtjkgh2/16cd24be60ba45d1955fce954737ea68.jpg,$232,Sloan light blue fabric square arm accent chair with reversible cushions 
https://pf-online-inventory-images.s3.us-west-1.amazonaws.com/online/r2dr88qp/75d2ea4a5c5d433f9272ba8b711cb147.jpg,$595,Vanguard Furniture Ridge whitewashed grey wood console table with white marble top
https://pf-online-inventory-images.s3.us-west-1.amazonaws.com/online/h9fzzpm9/52b388e4d62c4ba4bfcb4b2231cfc566.jpg,$148,Mitchell Gold & Bob Williams cherry 1 drawer side table with open storage and pull out
https://pf-online-inventory-images.s3.us-west-1.amazonaws.com/online/zg13wwih/54eddf72614c4f9ca8314ebbdd4e98f6.jpg,$145,La-Z-Boy Aberdeen beige bonded leather executive chair
https://pf-online-inventory-images.s3.us-west-1.amazonaws.com/online/4o44as3s/11f8f5e7aa084213a1d2a09ac81adc72.jpg,$325,Reclaimed teak wood and black iron mail organizer with 2 open shelves 
https://pf-online-inventory-images.s3.us-west-1.amazonaws.com/online/4dk3ftkw/d5428854feea46d19989ee5b4a032978.jpg,$125,Walnut finish wood 6 ft tall 5 tier bookcase
https://pf-online-inventory-images.s3.us-west-1.amazonaws.com/online/vrhqcwq5/5fb35c3e9cde4659904a11f47c8c8ae1.jpg,$395,Stanley dark oak 4 drawer file storage chest & hutch top w/ glass shelf & key - Each
https://pf-online-inventory-images.s3.us-west-1.amazonaws.com/online/rjxykpc1/b82dfce050024dd283aba8b178fbfc40.jpg,$545,Large maple finish wood 4 piece corner desk w/ grey metal legs
https://pf-online-inventory-images.s3.us-west-1.amazonaws.com/online/4pxp0ygg/71ac684b48b34b2bb69b989b662c16bd.jpg,$395,Herman Miller Setu grey mesh lounge chair and ottoman
https://pf-online-inventory-images.s3.us-west-1.amazonaws.com/online/edwqvdpt/c545fd08b02b498c87b61d006e97b474.jpg,$459,Herman Miller Aeron size C black mesh ergonomic office chair 
https://pf-online-inventory-images.s3.us-west-1.amazonaws.com/online/zhcdhmm3/591577c059e64e93892bc3390940f11e.jpg,$395,Room & Board Basis style walnut & stainless 1 drawer computer desk
https://pf-online-inventory-images.s3.us-west-1.amazonaws.com/online/cmxwkc3q/67cf0e7f842d4e8896ee7ecf42e197ee.jpg,$159,Room & Board Copenhagen black finish wooden 2 drawer file cabinet on wheels 
https://pf-online-inventory-images.s3.us-west-1.amazonaws.com/online/w1ojzqfv/7e56615dfe1a40fda2f065b9d9701824.jpg,$708,"Herman Miller Airia walnut, white laminate & metal 1 door media cabinet w/ open storage "
https://pf-online-inventory-images.s3.us-west-1.amazonaws.com/online/qlhy5jne/33f2f33eb9e54f1bb36830817ac55399.jpg,$1420,"Herman Miller Airia walnut & white laminate 1 drawer desk w/ metal legs, storage & 3"
https://pf-online-inventory-images.s3.us-west-1.amazonaws.com/online/bj2xsqsd/f3fbcd393ace4e21a227a11dcbd7aaae.jpg,$721,Herman Miller Cognita walnut & white 2 drawer storage bench w/ olive green fabric cushion 
https://pf-online-inventory-images.s3.us-west-1.amazonaws.com/online/jytz2e1k/51fbdc72f9eb4a88bcc25b7f67ac0037.jpg,$157,Maple finish wood 5 tier bookcase
https://pf-online-inventory-images.s3.us-west-1.amazonaws.com/online/50dtbtwe/b6480f96826a470c9365ee6893dbb88c.jpg,$375,"Set of 4 different color Dolly folding chairs by Antonio Citterio by Kartell, Italy"
https://pf-online-inventory-images.s3.us-west-1.amazonaws.com/online/kxcb1ovq/1a2a550e182b4d65b1700f7bc2880a36.jpg,$328,Metzler narrow grey finish wood lighted bow front bookcase w/ 2 drawers & 2 glass shelves
https://pf-online-inventory-images.s3.us-west-1.amazonaws.com/online/5rhz2aka/361b9c164b184f0dbff1f407eee01dcf.jpg,$54,Motivate White Plastic and Grey Metal Stool by HON
https://pf-online-inventory-images.s3.us-west-1.amazonaws.com/online/iuhrihnc/82bd96d452234c8683408efa1459d3c6.jpg,$47,Turnstone Scoop White Plastic and Grey Metal Base Stool by Steelcase with Red Fabric Seat
https://pf-online-inventory-images.s3.us-west-1.amazonaws.com/online/vtwuy4da/e4c1fe61dee445e18b0f8a60061b0223.jpg,$138,Steelcase taupe metal office staff storage locker w/ robe & 2 file drawewardrs - No key!
https://pf-online-inventory-images.s3.us-west-1.amazonaws.com/online/3jbtnn52/3b35b59a804f4c0b88c8d73bc386f497.jpg,$166,Oak Barister bookcase with glass doors
https://pf-online-inventory-images.s3.us-west-1.amazonaws.com/online/aliv0255/81caa285142b4fee950663ab9a28c415.jpg,$151,Bassett Cherry finish wood 3 drawer office cabinet with 2 file drawers 
https://pf-online-inventory-images.s3.us-west-1.amazonaws.com/online/wjk20ikf/a0bdefa9829244db8d43017a317731c8.jpg,$58,Black metal and grey faux concrete 5 tier open bookcase
https://pf-online-inventory-images.s3.us-west-1.amazonaws.com/online/e0r3yt4f/e494641cc3c546a4ad2beadf4b64d183.jpg,$1295,Type setters cabinet soild wood
https://pf-online-inventory-images.s3.us-west-1.amazonaws.com/online/51wfc4vo/bf2884f57d0a428f8862d537838f1ae9.jpg,$135,Temahome Wind white finish geometric 5 tier open bookcase 
https://pf-online-inventory-images.s3.us-west-1.amazonaws.com/online/wq4pmip3/3a84fc0a07a848c1a12a1d9af8dbeeda.jpg,$536,Henredon carved dark oak 2 drawer writing desk
https://pf-online-inventory-images.s3.us-west-1.amazonaws.com/online/jz0w2nyg/1d6dbb26259c48bb9a8962178ab8c394.jpg,$536,Monroy rustic oak finish wood 5 drawer desk with iron accents & keys
https://pf-online-inventory-images.s3.us-west-1.amazonaws.com/online/z40b1lm0/5b2778047d9042f6b15b3b5d06bdddeb.jpg,$799,Reclaimed wood and iron kidney shaped 2 drawer desk with colorful front
https://pf-online-inventory-images.s3.us-west-1.amazonaws.com/online/spl0f3ru/bff35fca6a9e40b684c4d95b17938135.jpg,$986,8.5 ft tall dark cherry and sage green wood 7 tier bookcase 
https://pf-online-inventory-images.s3.us-west-1.amazonaws.com/online/nelrb3bl/32f3b345cf4b4005a80e739df52f414f.jpg,$1346,"Large black finish wood & mesh 2 door lighted cabinet w/ gold accents
  1st floor only"
https://pf-online-inventory-images.s3.us-west-1.amazonaws.com/online/phflqom1/c1697176f28f41bcb5c1ce55ca99e165.jpg,$220,"Ranch oak executive desk with chair, 1st floor delivery only"
https://pf-online-inventory-images.s3.us-west-1.amazonaws.com/online/1a5ku25f/f6c4c8a6d1d24c1cb920646161fe32f7.jpg,$225,Ashley Furniture Townser dark greyish brown wood 4 drawer desk
https://pf-online-inventory-images.s3.us-west-1.amazonaws.com/online/l3os12ze/e2a6f91af6d542e1a63f979cf5b719ca.jpg,$616,Antique dark oak 5 drawer desk with barley twist trestle base and legs
https://pf-online-inventory-images.s3.us-west-1.amazonaws.com/online/dt3syu1l/8db18acb25fa4e95abdc4d70ec5010fc.jpg,$1016,Large rustic distressed oak 3 drawer desk
https://pf-online-inventory-images.s3.us-west-1.amazonaws.com/online/tcuf5y4i/e4e9ec91fdea4fc4bbc77eea5ded0769.jpg,$165,Amaturo clear acrylic saw horse writing desk with glass top
https://pf-online-inventory-images.s3.us-west-1.amazonaws.com/online/a1io1crz/74d22f2149414262ab85c646273a22c5.jpg,$319,Anki modern white & natural wood top 3 drawer writing desk w/ clear acrylic base - As is!
https://pf-online-inventory-images.s3.us-west-1.amazonaws.com/online/tkpg2zzg/acb3a9e7dce6401683b5f82423d5ff2f.jpg,$591,Industrial grey metal and ornate carved teak wood 2 tier arched bookcase on wheels 
https://pf-online-inventory-images.s3.us-west-1.amazonaws.com/online/0udsmux5/820b58aa5cd1457aa017420cdc5ae202.jpg,$761,Hooker Furniture Rustic Glam 3 drawer trestle base writing desk w/ shimmery accents 
https://pf-online-inventory-images.s3.us-west-1.amazonaws.com/online/rtp0a02y/de68f8d888fc40b784ec3583a9bebb25.jpg,$396,Century black tufted office chair w/ brad trim
https://pf-online-inventory-images.s3.us-west-1.amazonaws.com/online/0fwzbunw/7b5555b219d64e83817f42acc803a788.jpg,$701,Rustic Glam Writing Desk
https://pf-online-inventory-images.s3.us-west-1.amazonaws.com/online/wt1psdvg/efca2cd217414b51be26b073b3b22465.jpg,$76,Narrow cherry veneer 10 tier bookcase 
https://pf-online-inventory-images.s3.us-west-1.amazonaws.com/online/k0yx0cmd/8f913527271145ab9763c232a3ecc9bb.jpg,$146,Vintage grey desk with 5 drawers
https://pf-online-inventory-images.s3.us-west-1.amazonaws.com/online/2ha1euem/88ee08dfa2e84e45b6265cdf4df8dc8a.jpg,$596,Bellos ornate mahogany wood 7 drawer executive desk w/ embossed leather top & gold
https://pf-online-inventory-images.s3.us-west-1.amazonaws.com/online/svaqz5bi/c3994d0922014d53a3b0f082ba658324.jpg,$484,Loki black finish solid wood & metal 2 drawer writing desk w/ 2 door hutch & leather pulls
https://pf-online-inventory-images.s3.us-west-1.amazonaws.com/online/tiwttrrc/7e85d2ae62dd4c9b9737b9368a792487.jpg,$75,Ikea narrow birch 1 door cabinet on grey plastic base
https://pf-online-inventory-images.s3.us-west-1.amazonaws.com/online/aaejod5d/679246d88aef415b8cd4e660ec94b537.jpg,$169,Black finish wood 1 drawer computer desk with keyboard tray
https://pf-online-inventory-images.s3.us-west-1.amazonaws.com/online/fm3sftko/a5405166c4384cb78bac241504eee7a2.jpg,$169,Black finish wood 2 drawer lateral file cabinet
https://pf-online-inventory-images.s3.us-west-1.amazonaws.com/online/lrvsbgku/9a404e2a001a4cb9b9d79701f935790d.jpg,$116,Black leather and chrome 2 drawer writing desk
https://pf-online-inventory-images.s3.us-west-1.amazonaws.com/online/yq14y51m/94f7fc7688634b6ba213131c6e30b228.jpg,$49,Vintage Herman Miller green molded fiberglass student desk/ chair combo
https://pf-online-inventory-images.s3.us-west-1.amazonaws.com/online/2qc5wwhd/32861ffa14d24d4ca690529548240704.jpg,$49,Vintage Herman Miller white molded fiberglass student desk/ chair combo
https://pf-online-inventory-images.s3.us-west-1.amazonaws.com/online/sbrklyoy/9e6d3a3bb063469fb17367ad30506505.jpg,$62,Vintage walnut 2 drawer legal size filing cabinet with brown formica top and keys
https://pf-online-inventory-images.s3.us-west-1.amazonaws.com/online/bb5f0tb2/0f732376639a4621809e2fde09e58129.jpg,$2000,"Large White Marble Top Desk, Wooden Oak X Frame with double sided drawers - 36"" x 72"""
https://pf-online-inventory-images.s3.us-west-1.amazonaws.com/online/3qi3qj1t/65981e3031f44c858da6d316362b7354.jpg,$192,Industrial style black metal and pine 3 tier open bookcase on wheels
https://pf-online-inventory-images.s3.us-west-1.amazonaws.com/online/ryd25hfc/12ed6442691b49d28e5c07fa46657311.jpg,$322,Borge Mogensen MCM Danish teak 2 drawer drop leaf desk w/ extendable top & adj knee hole
https://pf-online-inventory-images.s3.us-west-1.amazonaws.com/online/4c50k5sl/78c20e1a55f34f7d992bcdb58a4aa528.jpg,$82,Crate & Barrel Rigby wall hanging 2 door media console w/ glass top. Needs French cleats
https://pf-online-inventory-images.s3.us-west-1.amazonaws.com/online/c2vre5dy/f0e3b5bd52f8418585c047df4e8b4cd5.jpg,$417,Medina espresso laminate adjustable height desk
https://pf-online-inventory-images.s3.us-west-1.amazonaws.com/online/zom2djd4/cf38c6e393c1458ca62c54ef81304e6e.jpg,$417,Hekman oval inlaid cherry & burlwood 7 drawer executive desk w/ keys. 1st Floor Only! 
https://pf-online-inventory-images.s3.us-west-1.amazonaws.com/online/l5xbq4gz/1bd334f9970c42518bc7790f361bb8b9.jpg,$57,Walnut veneer 1 door office cabinet with open storage 
https://pf-online-inventory-images.s3.us-west-1.amazonaws.com/online/hkyy1mxp/027bdb5c429f4c97bd6a1ad2164091a7.jpg,$248,BDI Eileen modern walnut finish wood & smoked glass 5 tier leaning ladder bookcase
https://pf-online-inventory-images.s3.us-west-1.amazonaws.com/online/f3nssg4k/23ef6cdeb23947e3b8c840882038ec20.jpg,$212,Galeria brown solid poplar and grey iron 2 drawer file cabinet with black leather pulls
https://pf-online-inventory-images.s3.us-west-1.amazonaws.com/online/bci3qr2f/392d05de220a44c393c9c4ba870f906c.jpg,$32,White faux leather and chrome office chair with padded arms 
https://pf-online-inventory-images.s3.us-west-1.amazonaws.com/online/oepiryse/fc3ceda9242e4a7d8019ffbb3b33e29d.jpg,$48,Espresso finish wood 2 door office cabinet with keyboard tray 
https://pf-online-inventory-images.s3.us-west-1.amazonaws.com/online/431ked44/2ae2f50aec054a4c8280b099e676d0f9.jpg,$232,PFC Side Entry 5-Shelf Curio Cabinet in Weathered White
https://pf-online-inventory-images.s3.us-west-1.amazonaws.com/online/oejfhrzk/eb14c2dc68ab4fd0bc9d65b0d01fe6d9.jpg,$295,Bernhardt Touhy task chair- Gray
https://pf-online-inventory-images.s3.us-west-1.amazonaws.com/online/2a1pibvl/f30440ac92a44fe6a9ff3203132bf570.jpg,$268,Inside Weather Latte Zorn media desk
https://pf-online-inventory-images.s3.us-west-1.amazonaws.com/online/5n4bhopa/8d3f7685c16f4b8c893c565617a9e32e.jpg,$122,Vintage Remington Rand industrial black metal 11 drawer card cabinet. 1st Floor Only 
https://pf-online-inventory-images.s3.us-west-1.amazonaws.com/online/l4kffnty/ca6fd6be94bc416d855c3df99bc02ddb.jpg,$350,Norman Bel Geddes Mid Century Modern powder coated steel pale aqua Ivory 4 drawer desk 
https://pf-online-inventory-images.s3.us-west-1.amazonaws.com/online/ad3ofni5/c79254bfc67149e494a230ed43a56510.jpg,$11,Black plastic chair on chrome base 
https://pf-online-inventory-images.s3.us-west-1.amazonaws.com/online/fb6izw7a/340d186ed946434caf5f615ad7b3008a.jpg,$99,Black  cushion office  chair 
https://pf-online-inventory-images.s3.us-west-1.amazonaws.com/online/ehsfnops/95366eca7dce4680bf4ad5965eafee39.jpg,$695,Freeform monkey wood wall hanging. Not guaranteed against cracking!
https://pf-online-inventory-images.s3.us-west-1.amazonaws.com/online/tfyuoic1/15116b42433342a29c0ce7ef89d13566.jpg,$1750,Life size carved wood Native American statue. Not guaranteed against cracking! 1st Floor 
https://pf-online-inventory-images.s3.us-west-1.amazonaws.com/online/4vpexvff/a17770a30839461b8ae8a622c39582fe.jpg,$95,"Grey and white scroll design 9' x 12' area rug. As is, used. No return!"
https://pf-online-inventory-images.s3.us-west-1.amazonaws.com/online/otkkkh12/7d91f2c93a6e40a5bc85e1e7cc371ca2.jpg,$75,"Surya Pune abstract ivory, grey & blue 7' 10"" X 10' 2"" area rug - As is, used. No return!"
https://pf-online-inventory-images.s3.us-west-1.amazonaws.com/online/kflgoa32/2ced51a5b18e4d42a3b56b99850fbedb.jpg,$245,Angela Rose x Loloi Aubrey sage green & brown 10' x 14' area rug
https://pf-online-inventory-images.s3.us-west-1.amazonaws.com/online/xxbgnalr/95c8af4be62a4837ae29c43c8f987894.jpg,$1095,Cassina hand-loomed bamboo silk ivory & sky blue abstract design 10' x 14' area rug
https://pf-online-inventory-images.s3.us-west-1.amazonaws.com/online/loxmam1z/3959890bf8fa43b5a3fa0eb62dbd0bbd.jpg,$95,Pair of Studio A heavy square reclaimed wood wall hangings
https://pf-online-inventory-images.s3.us-west-1.amazonaws.com/online/gxkwb02b/5abb24c3e9a04017bd12aca4dc0b352f.jpg,$395,Metal and crystal style ceiling light cash and carry only 
https://pf-online-inventory-images.s3.us-west-1.amazonaws.com/online/u2z2xa3r/121d7ac903cc445d90a9c68c903e62fb.jpg,$165,Black and maroon bamboo frame Asian design 3 panel room divider w/ gold floral accents
https://pf-online-inventory-images.s3.us-west-1.amazonaws.com/online/bmnopod2/e78c211b72464e11876f3db7edb78324.jpg,$43,Square cream color ornate cast metal planter box
https://pf-online-inventory-images.s3.us-west-1.amazonaws.com/online/ksqp0cfb/dcbbbc6d040746eeb45c78583a0851b3.jpg,$62,Green art deco large desk lamp
https://pf-online-inventory-images.s3.us-west-1.amazonaws.com/online/k0zghypc/b2e8264865b14440bfd851a2ceef8cd3.jpg,$25,"""From What I Remember"" framed print by Jane Schmidt"
https://pf-online-inventory-images.s3.us-west-1.amazonaws.com/online/w0tb52rq/94793a62a4c64903ba9ab0d2d7b94917.jpg,$25,Set of 8 Carved Stone Hindu Elephants in Carrying Case
https://pf-online-inventory-images.s3.us-west-1.amazonaws.com/online/toocgpix/fd232f2caf374688b5d09ff67e32c512.jpg,$8,"Pair of thin wooden statuettes, Handmade in Kenya"
https://pf-online-inventory-images.s3.us-west-1.amazonaws.com/online/pavrbvxt/bf9e6e93cd5f4246befd822ff109edc2.jpg,$43,African wood carved Songye statue
https://pf-online-inventory-images.s3.us-west-1.amazonaws.com/online/jcncub4n/897072fa9efd47de80e5933fad06f578.jpg,$33,Set of Authentic Indonesian Hand Carved Wooden Batik Mask
https://pf-online-inventory-images.s3.us-west-1.amazonaws.com/online/iasfzo1w/44a96be921fa4fa09efc1db61fdb0068.jpg,$142,"""Petroglyph #1"" by Late Taos artist Elizabeth Couse, with authenticity paperwork "
https://pf-online-inventory-images.s3.us-west-1.amazonaws.com/online/k0oldhn5/dd9cd6685eec4c7d9ace2fa18665df83.jpg,$25,"""From What I Heard"" framed print by Jane Schmidt"
https://pf-online-inventory-images.s3.us-west-1.amazonaws.com/online/trhzh5dw/bf10d672dbc34077b87d4d662685ee44.jpg,$25,"""From What I Heard"" framed print by Jane Schmidt"
https://pf-online-inventory-images.s3.us-west-1.amazonaws.com/online/oixhcm0l/dc1b8ebfb5da4dd3b5bc87782bb2872e.jpg,$25,"""From What I Saw"" framed print by Jane Schmidt"
https://pf-online-inventory-images.s3.us-west-1.amazonaws.com/online/cn4lkjm2/ce753b138be3477b96c9ac61b2f948c9.jpg,$25,"""From What I Imagined"" framed print by Jane Schmidt"
https://pf-online-inventory-images.s3.us-west-1.amazonaws.com/online/4hrsskle/a754151f1d404a49b94d167eddc61e16.jpg,$119,Anisetta Evangelisti Liquor Framed Print with Monkey
https://pf-online-inventory-images.s3.us-west-1.amazonaws.com/online/vuvseius/79c0172e1d6045809b5a9dea02dfe4a3.jpg,$356,"""The Horses March Wind"" by Wendover Art Group - Neiman Marcus Designer Wall Art"
https://pf-online-inventory-images.s3.us-west-1.amazonaws.com/online/eqdx5ry5/0f0ffb7b80ce48a6917dfd770348d099.jpg,$470,"""Escape into Life"" original acrylic on canvas by Mark Horst, Late Painter from New Mexico"
https://pf-online-inventory-images.s3.us-west-1.amazonaws.com/online/c3qq0ju4/2aa9e286ef8143f0adb99fe62d3fa61c.jpg,$261,"""IN JAMBAKKAM No. 13"" original acrylic on canvas by Mark Horst, Late New Mexico Painter"
https://pf-online-inventory-images.s3.us-west-1.amazonaws.com/online/yobcty5e/2864aab133e84b4696a0f92dc78e63fe.jpg,$356,"""IN JAMBAKKAM No. 17"" original acrylic on canvas by Mark Horst, Late New Mexico Painter"
https://pf-online-inventory-images.s3.us-west-1.amazonaws.com/online/3ucf2pmb/036e74aba94746ebae1c169a8ec97561.jpg,$470,"""Spectacle Danseuse"" original art by Sherri Belassen, Renowned Contemporary Painter"
https://pf-online-inventory-images.s3.us-west-1.amazonaws.com/online/k41mudsu/226ff5116f744209bd84866562ea0147.jpg,$43,"Original Art by Yasmin, Mixed Media on Canvas, 2002"
https://pf-online-inventory-images.s3.us-west-1.amazonaws.com/online/rkgjmxwr/8c07c8db76af4c1eb13c327a9fe2923c.jpg,$71,"""Carmen"" Original acrylic art in brushed silver frame, red woman"
https://pf-online-inventory-images.s3.us-west-1.amazonaws.com/online/crx4qsuj/276e99333b554ef7b8526fe28581c1a7.jpg,$71,"""Taylor"" Original Acrylic Art in brushed silver frame, blue woman"
https://pf-online-inventory-images.s3.us-west-1.amazonaws.com/online/45viqybl/711142bc7b5a4d1f8d6ba74c89ff7762.jpg,$90,"Industrial Metal Pipe Wall Art, Signed Original Mixed Media"
https://pf-online-inventory-images.s3.us-west-1.amazonaws.com/online/2eeq322p/a6bc0dbb2b7e4145aac931455503da0f.jpg,$138,"Schiffman brown, beige and white animal print 8' 10"" x 12' area rug"
https://pf-online-inventory-images.s3.us-west-1.amazonaws.com/online/u2kuf2z0/65c01e62bc6e472fafee10d4e3472c21.jpg,$375,Grey and white carved solid mango wood 3 panel folding room divider 
https://pf-online-inventory-images.s3.us-west-1.amazonaws.com/online/3yhmg32y/09f65116eac64c76a1692bfe0412082f.jpg,$225,Royal navy 32 pinnacle ship in glass case
https://pf-online-inventory-images.s3.us-west-1.amazonaws.com/online/o2r4dkl2/9f13e93dd9704fb1889e3c38593b927f.jpg,$445,Model scale ship made of glass in glass case 
https://pf-online-inventory-images.s3.us-west-1.amazonaws.com/online/3nfn1ewf/0c96cdac999d4d1d853aa440615f9b44.jpg,$295,Single man scull boat model in glass case 
https://pf-online-inventory-images.s3.us-west-1.amazonaws.com/online/a1axq0qw/051216c7fd9c49ba9d5f776b1c09635b.jpg,$350,Martini achter 1973 the race of the century model in glass case 
https://pf-online-inventory-images.s3.us-west-1.amazonaws.com/online/whxgzjep/6c4ea0be2fa74b1e90ce76a434bb57a6.jpg,$265,Mischief shop model in glass case 
https://pf-online-inventory-images.s3.us-west-1.amazonaws.com/online/we20prih/7458f185d34743aea861294651c2d07a.jpg,$295,Beetle whaleboat with glass case 
https://pf-online-inventory-images.s3.us-west-1.amazonaws.com/online/ldx151hg/dfc77603340d4475ab7b376ed58ce5aa.jpg,$395,Blue green Hercules ship in glass case
https://pf-online-inventory-images.s3.us-west-1.amazonaws.com/online/hqbqoav4/cc10bc44171b4e2a894a9d1a35e4cbdb.jpg,$138,Blue textured hand blown glass bowlon cherry wood display stand
https://pf-online-inventory-images.s3.us-west-1.amazonaws.com/online/d4ehd4h5/794adf096d34474bbe5212f1bdac39c4.jpg,$43,Round white clay plant stand with silver metal base and trim
https://pf-online-inventory-images.s3.us-west-1.amazonaws.com/online/i34pahsq/99a543010b8945b39529a04c62893c99.jpg,$806,"Jemsa Jute Rug, Moss, 9x12"
https://pf-online-inventory-images.s3.us-west-1.amazonaws.com/online/nb3zsj0p/8a88a90f725b40828d537d7812bebea9.jpg,$122,Bodrum Vintage Rio aqua floral 8' x 10' area rug
https://pf-online-inventory-images.s3.us-west-1.amazonaws.com/online/cnhhc04l/2f54f684d99b4130ba3cd8ea551c202b.jpg,$248,"Tyngsborough green hand tufted wool Southwestern design 9' x 12' area rug - As is, tear"
https://pf-online-inventory-images.s3.us-west-1.amazonaws.com/online/sgsnkswt/96221d0c099b465aa09efd0031c8259a.jpg,$50,"Project 62 Triangles blue, grey & rust hand tufted wool 5' x 7' area rug. No return!"
https://pf-online-inventory-images.s3.us-west-1.amazonaws.com/online/sukcslcu/5eb81c069c594db3a4b5a12b2ef8c055.jpg,$144,"Antique blue and white enameled cast iron calorifere stove - As Is, lid damaged "
https://pf-online-inventory-images.s3.us-west-1.amazonaws.com/online/fuqpjori/949cde55dcbd42a3a965ba8eb1281a38.jpg,$188,"Black scroll wrought iron lantern - As is, some glass missing "
https://pf-online-inventory-images.s3.us-west-1.amazonaws.com/online/gcy1p1zv/f91a6ce24a8c483a8b5d491e4bcb6d95.jpg,$188,"Black scroll wrought iron lantern - As is, some glass missing "
https://pf-online-inventory-images.s3.us-west-1.amazonaws.com/online/a34oyrbi/0dc7683312d04dd582f6b2981e03b2ec.jpg,$266,"""Sensuous"" smoke fired ceramic statues by local Colorado artist -Chip Shaw"
https://pf-online-inventory-images.s3.us-west-1.amazonaws.com/online/uxpmommj/3eda99a7dd554c668e114fe6ad486195.jpg,$195,Luna Azul custom resin pour canvas 
https://pf-online-inventory-images.s3.us-west-1.amazonaws.com/online/j0js5yab/6bd02e3a59e143298a155ac2c4d89c68.jpg,$166,Square vintage brass torchiere floor lamp
https://pf-online-inventory-images.s3.us-west-1.amazonaws.com/online/kfqh1whf/2132ce2fa0d140b692099caf2251998b.jpg,$24,Black wrought iron 3 piece fireplace tool set on stand
https://pf-online-inventory-images.s3.us-west-1.amazonaws.com/online/iaplpr01/d57f79b9af724f078ad8143eb0afdaff.jpg,$98,Antique tall carved oak wall mirror
https://pf-online-inventory-images.s3.us-west-1.amazonaws.com/online/y4j4xowj/b744c16c661b4e4c97ddbe1626119902.jpg,$64,Wood frame arch top wall mirror
https://pf-online-inventory-images.s3.us-west-1.amazonaws.com/online/iuka20mc/40961dc2948b44378aa624657310564b.jpg,$395,Chinese carved wood table top mirror 
https://pf-online-inventory-images.s3.us-west-1.amazonaws.com/online/1bxz54gw/cec947028cc54fb0882eb54982b4eedd.jpg,$145,"""Geometry Workbook II"" original art on clayboard by Blair Vaughn-Gruler, renowned artist "
https://pf-online-inventory-images.s3.us-west-1.amazonaws.com/online/1prkubua/5e38272dc6114bf5a86d5a51a954b89a.jpg,$200,Colorful abstract oil on canvas by Doug Moore
https://pf-online-inventory-images.s3.us-west-1.amazonaws.com/online/qojjzw4e/1272d330ef7e4cefabb9bf019d757453.jpg,$50,"Pair of Crate & Barrel watercolor art in white frames, artist signature "
https://pf-online-inventory-images.s3.us-west-1.amazonaws.com/online/22r5fnyt/57cb07c06a4c4c68b87134c72e5faf36.jpg,$50,Saffron I abstract geometric design canvas wall art- as is damaged canvas 
https://pf-online-inventory-images.s3.us-west-1.amazonaws.com/online/ktmfsp5o/141c9e1d8763498a818227c6be88ca1d.jpg,$65,Vintage Empire telescope on tripod stand
https://pf-online-inventory-images.s3.us-west-1.amazonaws.com/online/wnvyfuzj/7739eaca47b14573b120639bd09ad9aa.jpg,$125,Vintage movie camera on tripod stand
https://pf-online-inventory-images.s3.us-west-1.amazonaws.com/online/zktkjkuy/0f7e24c6840144d7b7457815058ecb1f.jpg,$75,Black round mirror 
https://pf-online-inventory-images.s3.us-west-1.amazonaws.com/online/2w1luo2c/9e05558166834cae88acb9322687d399.jpg,$32,Pair Pottery barn bell decor 
https://pf-online-inventory-images.s3.us-west-1.amazonaws.com/online/iecrlp20/15df87fca24044bab568ad2222da498c.jpg,$69,Danbury bisque tatsuo doll set 
