image_url,price_text,image_title
https://pf-online-inventory-images.s3.us-west-1.amazonaws.com/online/gn3khf15/a8a4ad79b96140778e45857163744f20.jpg,$421,Mahogany finish wood and jute armchair with tan suede cushions & brad trim
https://pf-online-inventory-images.s3.us-west-1.amazonaws.com/online/mnha4iwh/8245946fcc65463580a05513908a5f50.jpg,$254,Large rectangular ornate wood coffee table with dark distressed inlaid top
https://pf-online-inventory-images.s3.us-west-1.amazonaws.com/online/hlhxvyao/17a6df20d6d248aebcc76c2b2ff730b8.jpg,$506,Brown faux painted floral patina 3 drawer console table 
https://pf-online-inventory-images.s3.us-west-1.amazonaws.com/online/pny5kilt/cf41d113411f4e4daab3ebeb26fab80e.jpg,$846,"Santerini iron, marble and glass 3 tier console - As is, marble and glass chipped"
https://pf-online-inventory-images.s3.us-west-1.amazonaws.com/online/4yuiw0kj/9686d9f3bd9b41fda292a7430f540b76.jpg,$251,"Gold bamboo design iron and glass console table - As is, glass chipped"
https://pf-online-inventory-images.s3.us-west-1.amazonaws.com/online/yjuoobkv/df0ea66b63ed45c8baf66d191046da57.jpg,$336,Black wood & glass 4 tier shelf w/ red & gold Chinoiserie design & 3 glass shelves
https://pf-online-inventory-images.s3.us-west-1.amazonaws.com/online/ep3gg0o1/cf6589aa48094717a119c21afa6d4bdd.jpg,$336,Black wood & glass 4 tier shelf w/ red & gold Chinoiserie design & 3 glass shelves 
https://pf-online-inventory-images.s3.us-west-1.amazonaws.com/online/4nehhgqv/dffeb11aca2d457183d4b883f0bc4c4e.jpg,$633,Diamond Sofa white linen slipcovered square arm sofa with reversible cushions 
https://pf-online-inventory-images.s3.us-west-1.amazonaws.com/online/cqbni2ka/6937880671674d33a5cd7cfad022ed28.jpg,$761,"Simeon light blue fabric rolled arm sofa w/ tan piping, brad trim & 4 accent pillows"
https://pf-online-inventory-images.s3.us-west-1.amazonaws.com/online/aeunzmyy/0e4ce811a117401c9c49095cefa60acb.jpg,$1495,Unique custom made teak and camel color leather rocking lounge chair and ottoman
https://pf-online-inventory-images.s3.us-west-1.amazonaws.com/online/nmkusjs1/011381ac1a8c48f999084bf778f19e67.jpg,$595,Shurtz cream velvet curved sofa with gold metal legs
https://pf-online-inventory-images.s3.us-west-1.amazonaws.com/online/cjx2xypr/4dfdd604b2324cb9818c58214a867feb.jpg,$195,White vinyl mid century modern hoop saucer chair with wood legs
https://pf-online-inventory-images.s3.us-west-1.amazonaws.com/online/r0pn2he3/e70c1153761345819ac3dfedcd623f5b.jpg,$140,Distressed ivory wood frame armchair w/ gold striped fabric seat & multicolor fabric back
https://pf-online-inventory-images.s3.us-west-1.amazonaws.com/online/lemmtfdf/7cfdbd1498804576a4588334a207afb3.jpg,$421,Walnut finish console table w/ grey marble top & porcelain & brass accents & wall mirror
https://pf-online-inventory-images.s3.us-west-1.amazonaws.com/online/sbngrg3m/625dbfd7fc8c4d05855031107b1fd4d9.jpg,$64,Antique rectangular carved oak side table
https://pf-online-inventory-images.s3.us-west-1.amazonaws.com/online/524qh3t3/29347f5e93f8404984d357a2adcf41e5.jpg,$166,Round ornate carved wood red and black Asian design coffee table
https://pf-online-inventory-images.s3.us-west-1.amazonaws.com/online/5v5mba3o/82a7cea89d9d4494b47e941ed0e60484.jpg,$166,Cherry finish wood frame curved leg armchair w/ gold needle point back & floral cushion
https://pf-online-inventory-images.s3.us-west-1.amazonaws.com/online/e2gf31rz/9a5f7233f1dd4f3a88fac5abeff3d52a.jpg,$166,"Rosewood carved Asian 1 drawer, 2 door accent cabinet"
https://pf-online-inventory-images.s3.us-west-1.amazonaws.com/online/nla33waf/dd854f87dbc44c38b0d79f3d32a2d505.jpg,$135,Antique dark finish wood Asian dining armchair 
https://pf-online-inventory-images.s3.us-west-1.amazonaws.com/online/sw5znosh/79c11f79248042b5a93b895113cac7a5.jpg,$421,Acer black iron 2 drawer console table with open lower shelf 
https://pf-online-inventory-images.s3.us-west-1.amazonaws.com/online/t4xybzgz/9c7c059f7c7d4fb2b23416fb6c5f1bed.jpg,$316,A.R.T. Furniture beige fabric armless chair w/ sage leather trim & gold metal legs
https://pf-online-inventory-images.s3.us-west-1.amazonaws.com/online/s51lej3r/9c7be952709b4d8a8745af71ce580069.jpg,$272,Vestavia ornate cream wood frame & velvet armchair w/ gold accents & lumbar pillow
https://pf-online-inventory-images.s3.us-west-1.amazonaws.com/online/oqqm2fu0/50dfcd06589e42e0a1104ddbf86e931e.jpg,$421,Vestavia ornate cream wood frame & velvet loveseat w/ gold accents & 4 accent pillows
https://pf-online-inventory-images.s3.us-west-1.amazonaws.com/online/rddza4r0/0831fcdfba954ea593519c96a9b92025.jpg,$506,Ellahome Elite half round gold iron console table with white marble top
https://pf-online-inventory-images.s3.us-west-1.amazonaws.com/online/asxajhm2/619111087f7d4f58bae3d242017b7a17.jpg,$235,Rowan Stool Beige Ottoman 
https://pf-online-inventory-images.s3.us-west-1.amazonaws.com/online/ftey3lwb/50e5a01c79204ca6bd3408c0338e7da4.jpg,$83,Espresso wood and wicker rocking chair 
https://pf-online-inventory-images.s3.us-west-1.amazonaws.com/online/w5icpr0u/d955d8fa09674ff39dca77ceb22dea8e.jpg,$198,Antique Hall Tree 
https://pf-online-inventory-images.s3.us-west-1.amazonaws.com/online/rbnfox5e/62d795dc2adc46d5afd4ba9e55fe6727.jpg,$506,Ashley Casa Molino ornate cherry wood & glass 2 pc showcase w/ metal accent & 3 glass
https://pf-online-inventory-images.s3.us-west-1.amazonaws.com/online/zwninubx/5bab34bc532742cb9c7ff1eadd7024da.jpg,$336,Narrow multicolor reclaimed wood storage trunk
https://pf-online-inventory-images.s3.us-west-1.amazonaws.com/online/l4zaktrc/613499a3b7b84a489e881ce137877e3d.jpg,$591,Ornate cream finish wood 1 door curio cabinet w/ gold accents & 2 glass shelves
https://pf-online-inventory-images.s3.us-west-1.amazonaws.com/online/rqheetfs/066bf817d3844e04a244f46bbbca21ef.jpg,$98,"Danish style teak 2 door, 2 drawer TV armoire "
https://pf-online-inventory-images.s3.us-west-1.amazonaws.com/online/lf4v10yn/2ac7fc72a29f4883a478436954522c24.jpg,$745,Large ornate carved reclaimed teak wood console table
https://pf-online-inventory-images.s3.us-west-1.amazonaws.com/online/4o1gycq0/64cc9353e4f84b97811e9dfeb101b9b3.jpg,$13,Brown wood and  metal suede barstool 
https://pf-online-inventory-images.s3.us-west-1.amazonaws.com/online/kqmhzx1o/3baa7863e6cd4c96b8bdb6399ceee546.jpg,$83,Oval oak 1 drawer side table with spindle base
https://pf-online-inventory-images.s3.us-west-1.amazonaws.com/online/oyn0hnrw/38ec6567d60346e799a4aac3e28b6849.jpg,$81,Carved cherry finish wood spider back arm chair with maroon and tan floral seat
https://pf-online-inventory-images.s3.us-west-1.amazonaws.com/online/zsniu30q/0622c2f44b9844d2861107a95e94bce7.jpg,$81,Mahogany and sage green scroll pattern fabric gooseneck arm chair
https://pf-online-inventory-images.s3.us-west-1.amazonaws.com/online/lq4euxc4/2d7f41c176c14b228969700bbe0e213f.jpg,$166,Hickory Chair Co. carved wood frame and gold & ivory toile fabric arm chair
https://pf-online-inventory-images.s3.us-west-1.amazonaws.com/online/5pnq00mf/18d97df092294de2b1d047bc84259ea4.jpg,$156,Square gun metal chrome and glass coffee table with circle designs
https://pf-online-inventory-images.s3.us-west-1.amazonaws.com/online/dfdpgww3/e1f6ea8ebe5e41a6a702cea1ca998783.jpg,$276,Pair of vintage American desk ivory molded fiberglass and chrome side chairs
https://pf-online-inventory-images.s3.us-west-1.amazonaws.com/online/2q5a2jao/802689c08de6422790c8811323206c8f.jpg,$421,Jones grey velvet square arm mid mod style loveseat w/ black metal legs
https://pf-online-inventory-images.s3.us-west-1.amazonaws.com/online/dvnt30wu/31ea235781b54114b16713e58aa8ee20.jpg,$166,Cherry finish wood 4 drawer media console w/ 2 glass panel doors and open storage
https://pf-online-inventory-images.s3.us-west-1.amazonaws.com/online/3g2n2myg/2338aad7c9e541e894dffb520a958782.jpg,$156,Oak and glass 4 door curio cabinet with 4 glass shelves 
https://pf-online-inventory-images.s3.us-west-1.amazonaws.com/online/nqjevurp/f3e348e435194da8bc77d30306bc3a62.jpg,$796,Plethoria Victoire ornate dark walnut finish wood frame & beige fabric sofa w/ 6 pillows
https://pf-online-inventory-images.s3.us-west-1.amazonaws.com/online/h3gux5el/3fc1e61a1c2e4d98b1eb55c8fa5f4839.jpg,$100,Andrighetti square navy blue and white zig zag hatch pattern fabric ottoman
https://pf-online-inventory-images.s3.us-west-1.amazonaws.com/online/1w4iigt3/e4021e850efc49668230d819e99d259f.jpg,$145,"""January"" by Wendover Art Group - Designer Wall Art with Gold Webbed Design"
https://pf-online-inventory-images.s3.us-west-1.amazonaws.com/online/q5ubtye0/434fb3b0e14e41c58ec755937abe9b5a.jpg,$196,Dark cherry 4 drawer half moon chest with black top and crystal knobs 
https://pf-online-inventory-images.s3.us-west-1.amazonaws.com/online/qrutwvbz/ec0d9314adf6433d9bb73b07a9ac185d.jpg,$360,Jahaziah brown Asian influence 3 drawer lift top accent chest on black metal base
https://pf-online-inventory-images.s3.us-west-1.amazonaws.com/online/al2q3cv5/b2579c683846483a8edf1795fd519541.jpg,$195,"Anneus oak & glass 2 door corner curio cabinet w/ 4 glass shelves - As is, cracked mirror"
https://pf-online-inventory-images.s3.us-west-1.amazonaws.com/online/mbzjyoeu/c7721a22440b45d5a0274c1d81e0d74c.jpg,$916,Coastal Living Sandbar Beige Wood 2 Door Armoire with Raffia Accent
https://pf-online-inventory-images.s3.us-west-1.amazonaws.com/online/1urbiyca/dcea274204394e9b931d75e54af755f8.jpg,$184,Burgundy Norwalk armchair with red houndstooth pillow
https://pf-online-inventory-images.s3.us-west-1.amazonaws.com/online/jaud0oa4/f3aa68a7be9347288c6e0f858737a248.jpg,$68,Grey and white chevron fabric storage ottoman with 2 matching throw pillows - SET ONLY
https://pf-online-inventory-images.s3.us-west-1.amazonaws.com/online/wuhzuhx3/f30ce2773bc04d42a5db65c540e41f97.jpg,$352,Interlude Home Emerson Round Back Grey Fabric and Bronze Metal Frame Chair
https://pf-online-inventory-images.s3.us-west-1.amazonaws.com/online/2r3mstkh/3988a1db3f464791875895900f2d010f.jpg,$49,Petite burgundy armchair 
https://pf-online-inventory-images.s3.us-west-1.amazonaws.com/online/op045wt5/3b61b06b3b0c43bb8ded19c2f6af6cbf.jpg,$94,Large animal print ottoman 
https://pf-online-inventory-images.s3.us-west-1.amazonaws.com/online/q1rzhedi/1718c6d616044a98993b8f1bef86c9f1.jpg,$576,"Four Hands Rockwell Collection Amma Black Metal & Glass Cabinet. 1st Floor Only! As is,"
https://pf-online-inventory-images.s3.us-west-1.amazonaws.com/online/nsb4akga/6d9f0f16f3df41039478268ba31e1896.jpg,$1012,"Eichholtz Crosby charcoal oak finish 2 drawer, 2 door TV cabinet with open storage "
https://pf-online-inventory-images.s3.us-west-1.amazonaws.com/online/wd2nxsaq/2f0b5fdd475a4577a4b76c20b9987322.jpg,$266,Ariah Coastal Beach Glass Top Brown Rattan Rectangular Coffee Table
https://pf-online-inventory-images.s3.us-west-1.amazonaws.com/online/b3532mi5/9709007a2530462eb2462af03345f843.jpg,$259,Drexel narrow black lacquer wood chinoiserie design 1 door curio cabinet w/ gold accents &
https://pf-online-inventory-images.s3.us-west-1.amazonaws.com/online/vtoq0oax/22c671170db1402d9bedba46f7fc6a80.jpg,$307,"Long, narrow rosewood Asian bench"
https://pf-online-inventory-images.s3.us-west-1.amazonaws.com/online/tm13seby/802e480fc5a14d2c8f986407bb628646.jpg,$184,Drexel Heritage black wood & green velvet arm chair w/ chinoiserie design on wheels
https://pf-online-inventory-images.s3.us-west-1.amazonaws.com/online/a1wze3nt/8d364c782cdb41a78f022cfc67b8a57a.jpg,$206,Marseille grey finish wood angled front entry console table
https://pf-online-inventory-images.s3.us-west-1.amazonaws.com/online/5dgdu14d/308b73906cb74d319e189b54a8b8b420.jpg,$446,Eloquence French style ornate pewter finish wood & white faux leather chaise lounge
https://pf-online-inventory-images.s3.us-west-1.amazonaws.com/online/ev2rz1hd/24b00b6417a746f0a77e49d0c9eff3f5.jpg,$298,"Calico Corners white, blue & green striped flare arm accent chair w/ nail head trim &"
https://pf-online-inventory-images.s3.us-west-1.amazonaws.com/online/kwh5zqgx/6e63965f28ee45b88ebddb9dba0d0bd9.jpg,$596,"Roman cherry finish wood 4 drawer, 4 door sideboard w/ arch design doors "
https://pf-online-inventory-images.s3.us-west-1.amazonaws.com/online/idnru0bm/fafe3e13adc0481ab4c1ed0dfcfe1ed9.jpg,$251,Carved teak wood flare arm bench with colorful floral accents
https://pf-online-inventory-images.s3.us-west-1.amazonaws.com/online/bea3zil5/77960f46eedf4321a245898b29a35eaa.jpg,$250,Sherrill Furniture lilac & grey paisley fabric serpentine front sofa w/ 2 pillows
https://pf-online-inventory-images.s3.us-west-1.amazonaws.com/online/ypihejnc/f109c76d1b62441babab482cf43a88cf.jpg,$1346,"Grey power reclining sofa
AS IS - minor damage"
https://pf-online-inventory-images.s3.us-west-1.amazonaws.com/online/m0j1puw5/162aeab366c34da894b79b3c56d59244.jpg,$1195,Burton James round multicolor stripe swivel chair & ottoman w/ brown cushions & 2 pillows
https://pf-online-inventory-images.s3.us-west-1.amazonaws.com/online/xo3n4jpq/a819ab32507040ccbe06488a69afd2c1.jpg,$82,"Antique small mahogany lift top storage box on ornate stand - As is, hole cut in back"
https://pf-online-inventory-images.s3.us-west-1.amazonaws.com/online/ex3kfv2w/0c429fb2df3a44d8a219f91d2cb29c3f.jpg,$746,Hooker La Grange aged tan iron base and stone top console table
https://pf-online-inventory-images.s3.us-west-1.amazonaws.com/online/iu2mys13/783822fcb49f4d7a9cde784ba41c9c06.jpg,$371,Taryn light brown pine finish drum coffee table on wheels 
https://pf-online-inventory-images.s3.us-west-1.amazonaws.com/online/q32w4cu1/3ba7d9c7fd6549e898c619f0b7c7b78d.jpg,$195,Custom pour Luna Azul original resin art
https://pf-online-inventory-images.s3.us-west-1.amazonaws.com/online/djpsdurh/173976fea92942feb908b364e1f70262.jpg,$44,Painted whiternd table with stone top
https://pf-online-inventory-images.s3.us-west-1.amazonaws.com/online/b3ain2zk/816d7d3773a04428afc06a175dc89cc1.jpg,$334,Adrea rectangular ornate walnut finish coffee table w/ black marble top & Queen Anne legs
https://pf-online-inventory-images.s3.us-west-1.amazonaws.com/online/1zxrtwdg/5f5e1784eb954e4c86bcde71d80bd108.jpg,$44,Lexington square mahogany 1 drawer side table on wheels 
https://pf-online-inventory-images.s3.us-west-1.amazonaws.com/online/fu0ty3ff/c2d3301542174c8d8c59fb2829b47796.jpg,$195,Landscape with mountains in the fall with a moose with Led lights 
https://pf-online-inventory-images.s3.us-west-1.amazonaws.com/online/wxtlw43a/b59fe55f83f94d6189852a928f2789e5.jpg,$195,Landscape with mountains on river with bear and Led lights
https://pf-online-inventory-images.s3.us-west-1.amazonaws.com/online/nlbwuydr/6c78154ea54048ada716d9dca025c41c.jpg,$556,Westnofa Danishmid century modern chair and ottoman 
https://pf-online-inventory-images.s3.us-west-1.amazonaws.com/online/n441mwo4/60c3f5f15e094c40a5a5140f95ea50ce.jpg,$206,"Alder wood 2 piece 5 door, 2 drawer entertainment center with open shelf"
https://pf-online-inventory-images.s3.us-west-1.amazonaws.com/online/p5qrplet/196494571d3341e185f06bd0f6b6b19d.jpg,$312,Lorts square walnut finish wood 6 drawer coffee table
https://pf-online-inventory-images.s3.us-west-1.amazonaws.com/online/51zrcfhr/6a0b0e1c732441b78b85262344751856.jpg,$346,Marshfield Furniture brown leather & tapestry fabric wingback chair w/ brad trim & ottoman
https://pf-online-inventory-images.s3.us-west-1.amazonaws.com/online/xo1zhfhr/aca020a39217410e85265ff56801d83a.jpg,$416,Lorts walnut finish wood 3 drawer sofa table
https://pf-online-inventory-images.s3.us-west-1.amazonaws.com/online/wdmei1uh/0c6dade709f143708b60cb29c70ff5b7.jpg,$52,The Bartley Collection Ltd maple Queen Anne style tea table with 2 pull out trays
https://pf-online-inventory-images.s3.us-west-1.amazonaws.com/online/ioxeln0r/14c9566b4ad445b0865098ac9108a087.jpg,$102,Antique scalloped edge mahogany inlaid coffee table
https://pf-online-inventory-images.s3.us-west-1.amazonaws.com/online/wvl34zli/5796e16eb9364a1dac8a27c3bc54099c.jpg,$172,Taupe finish concrete console table 
https://pf-online-inventory-images.s3.us-west-1.amazonaws.com/online/ij5svkfs/b035e1e917c7418aa7768d063c40806e.jpg,$276,Ardley Hall rectangular distressed black and gold carved wood scalloped edge coffee table
https://pf-online-inventory-images.s3.us-west-1.amazonaws.com/online/fevrj5ha/e66149c81f124fa399705f82d4176dd5.jpg,$326,Modern black leather arm chair with chrome legs
https://pf-online-inventory-images.s3.us-west-1.amazonaws.com/online/ngfmpr2y/73ef96a39a084faeabb1348dd0f8fdeb.jpg,$276,Briamarie square low white sintered stone coffee table w/ black stainless steel legs &
https://pf-online-inventory-images.s3.us-west-1.amazonaws.com/online/eqcgzo04/b5c51559d3044ae88fea02e0959115aa.jpg,$312,Azka silver mirrored 2 door curio cabinet with 4 glass shelves
https://pf-online-inventory-images.s3.us-west-1.amazonaws.com/online/u1jbynv0/3ad489e4c26c4dd3b88b1c47132d2e5d.jpg,$192,Burt England burgundy fabric and chrome mid century modern arm chair
https://pf-online-inventory-images.s3.us-west-1.amazonaws.com/online/dockzmun/b23e58d856384b0da29f0466023435da.jpg,$38,Gold and white trellis pattern fabric tufted back armless accent chair
https://pf-online-inventory-images.s3.us-west-1.amazonaws.com/online/papcrp3u/3b031103c96341b4973ffef47297c37c.jpg,$192,"Tan leather and chrome Wassily mid century modern style armchair - As is, some cracking"
https://pf-online-inventory-images.s3.us-west-1.amazonaws.com/online/zkq5c5iz/74b3a841c81b41a19b0a6fc49b22465d.jpg,$127,Whitewash log and jute arm chair and ottoman with teal cushions
https://pf-online-inventory-images.s3.us-west-1.amazonaws.com/online/c5gjskgu/2a92ca97fd704043b57ce4fefe591b94.jpg,$647,Emelie sage linen fabric curved back recessed arm wood frame sofa w/ 2 pillows
https://pf-online-inventory-images.s3.us-west-1.amazonaws.com/online/occjftxi/f90222daf9f64102bbdc4da2709121e5.jpg,$647,Theodore Alexander Riva rectangular cherry finish wood & marble top 2 tier coffee table
https://pf-online-inventory-images.s3.us-west-1.amazonaws.com/online/4o54o3s0/990a5a4b8a684b83bf54d5e0bf01fc00.jpg,$25,Multi color Wicker coffee and end table set
https://pf-online-inventory-images.s3.us-west-1.amazonaws.com/online/zbcukqdt/53288333e3204ef79b49f8ab5b99222d.jpg,$146,Ashley Furniture Carlton large rectangular greywash pine finish coffee table 
https://pf-online-inventory-images.s3.us-west-1.amazonaws.com/online/bxymszyf/871b922824d44ba89510a1ca08dd88f9.jpg,$285,Sheridan round indigo ombre concrete coffee table
https://pf-online-inventory-images.s3.us-west-1.amazonaws.com/online/fxpodbtu/ae9e9ac26bc84c7e9ac773e592fae9aa.jpg,$387,Dark gold Asian influence curved end console table with black granite top
https://pf-online-inventory-images.s3.us-west-1.amazonaws.com/online/odwtmzrz/af476b4c47c0448bbbf88d5f3f6f4469.jpg,$57,Vintage rounded triangular oak pedestal end table
https://pf-online-inventory-images.s3.us-west-1.amazonaws.com/online/ylv51pic/1a8df411743a47f985c84e248ba3dd78.jpg,$417,Jye baby blue square arm sofa with 2 throw pillows 
https://pf-online-inventory-images.s3.us-west-1.amazonaws.com/online/hpku3tk3/1cbda0ccac8c40e0a87ba42c9865e487.jpg,$75,Mid century modern round chrome and brass base coffee table with glass top
https://pf-online-inventory-images.s3.us-west-1.amazonaws.com/online/ffytavw2/bf7324a3d6df41cca84d47e163bdec65.jpg,$285,Artistica Home Metal Designs Claret rectangular grey hammered iron & glass end table 
https://pf-online-inventory-images.s3.us-west-1.amazonaws.com/online/loi05kao/39fce48044ac4b7fbd89d98d0fb26941.jpg,$321,Razuri white faux marble finish 2 drawer solid wood TV stand with electric fireplace
https://pf-online-inventory-images.s3.us-west-1.amazonaws.com/online/cc2euapl/bb8f50fd91f14f829b9ca9f1a4b31e6f.jpg,$105,"Dark cherry 2 door, 1 drawer Asian style accent cabinet w/ stone designs & carved trim"
https://pf-online-inventory-images.s3.us-west-1.amazonaws.com/online/ue4r1oxq/17ccb55f46204b3c9ae3e4b2dbd97236.jpg,$171,Ultimate Accents black double sided 2 drawer console table w/ black granite top & gold
https://pf-online-inventory-images.s3.us-west-1.amazonaws.com/online/3htvbr3o/33e503def1b041dc8e01f2e8701e09f4.jpg,$177,Vestavia antique pearl finish wood coffee table with gold accents
https://pf-online-inventory-images.s3.us-west-1.amazonaws.com/online/val2e1p3/d6cd80489bac4a87a04262097f0ea3d5.jpg,$177,Jennifer Taylor Home Alana Lawson light beige fabric rolled arm accent chair
https://pf-online-inventory-images.s3.us-west-1.amazonaws.com/online/nvaafj12/46db9d4eeb1d4405b4a01bac3b993fb2.jpg,$417,Gray Lazboy chair and a half
https://pf-online-inventory-images.s3.us-west-1.amazonaws.com/online/2cy0wtlw/b329650ea456487f9a45e8f88a9109fa.jpg,$599,Reclaimed wood and metal 3 tier shelf
https://pf-online-inventory-images.s3.us-west-1.amazonaws.com/online/v5s0yo4l/207c3976e8d8475ca2e29b93006b0382.jpg,$399,Reclaimed oak 3 drawer sideboard 
https://pf-online-inventory-images.s3.us-west-1.amazonaws.com/online/xz0spfxw/c2524d1d923143c4a0fca44764ab10a3.jpg,$495,Reclaimed wood multi tier shelf 
https://pf-online-inventory-images.s3.us-west-1.amazonaws.com/online/qhgsdowc/f04a23453f5147be88cc2c9a071d6218.jpg,$162,Jennifer Taylor Home Alana Lawson light beige fabric rolled arm accent chair 
https://pf-online-inventory-images.s3.us-west-1.amazonaws.com/online/g2d1p2wj/d56cc9991e4f4ee09b034f95ebd63928.jpg,$69,Large square grey swirl design fabric ottoman 
https://pf-online-inventory-images.s3.us-west-1.amazonaws.com/online/5ejopk4x/0bf4c68f77c544a59243ccddf2eb5d04.jpg,$448,"The Claymont motorized smart TV lift cabinet for 65"" flat screen TVs. 1st Floor Only!"
https://pf-online-inventory-images.s3.us-west-1.amazonaws.com/online/5v3unieh/e8c5ef2bb631448aa78735a238ff5a8d.jpg,$188,Taryn square whitewashed oak wood veneer coffee table on wheels 
https://pf-online-inventory-images.s3.us-west-1.amazonaws.com/online/mla4ne5v/1808b17332824333a7c540d7c3af95a5.jpg,$148,"Oblong pewter finish 5 drawer accent chest with round gold knobs - As Is, top damage "
https://pf-online-inventory-images.s3.us-west-1.amazonaws.com/online/5ikzwfb4/a4168eaaa74143d5a7215ae90bc7643a.jpg,$222,Leathercraft Milana rectangular tan leather ottoman w/ curved cherry finish wood legs
https://pf-online-inventory-images.s3.us-west-1.amazonaws.com/online/qgljqn3v/746518be80484abeb32023a6f8a9babc.jpg,$48,Square cedar log end table with beige tile insert
https://pf-online-inventory-images.s3.us-west-1.amazonaws.com/online/4xkue2hc/b0c35c531bd043d496cf96228083417f.jpg,$62,Rustic pine 1 drawer console table with open shelf 
https://pf-online-inventory-images.s3.us-west-1.amazonaws.com/online/44ur13uq/5cbb787117ec4796a9fe14f864f66f7a.jpg,$298,Kareen square grey concrete block indoor/ outdoor coffee table
https://pf-online-inventory-images.s3.us-west-1.amazonaws.com/online/3tb4c12s/cf0a7b45b650484d9eecd37bbc7b5554.jpg,$44,Braxton culler one drawer side table blue berry colored 
https://pf-online-inventory-images.s3.us-west-1.amazonaws.com/online/c1r34b5p/a8237cc5aa1c42f1a7d061924ac5ed1d.jpg,$104,"Chrome 2 door, 4 tier open display shelf with dark woodgrain accents & 3 glass shelves"
https://pf-online-inventory-images.s3.us-west-1.amazonaws.com/online/pj4fq5av/c234eda2e91f42bab9c18f8207ab3d18.jpg,$248,Antique Asian cabinet 
https://pf-online-inventory-images.s3.us-west-1.amazonaws.com/online/gw0idh1p/b65b9515233b4325ae9902398516634c.jpg,$250,Baker Furniture Milling Road espresso finish wood 5 tier pyramid style etagere 
https://pf-online-inventory-images.s3.us-west-1.amazonaws.com/online/skhw1qtr/aba2e6b0967442edad2c239e424ac847.jpg,$595,Large wood chalkboard easel
https://pf-online-inventory-images.s3.us-west-1.amazonaws.com/online/sf42q3cp/0aa7d9002b4c4ccc9b1888b68441624a.jpg,$82,Cherry finish carved wood curved leg sofa table
https://pf-online-inventory-images.s3.us-west-1.amazonaws.com/online/f3fwixt3/d6b143f48fbe4983bea68579d9c93052.jpg,$235,"""Shoo fly"" by Anna dickey custom window pane panel art"
https://pf-online-inventory-images.s3.us-west-1.amazonaws.com/online/qbyeyoqb/ae6a2fd41364493b92a9ffcdf2b49cd7.jpg,$235,"""Dandelions "" by Anna dickey custom window pane panel art"
https://pf-online-inventory-images.s3.us-west-1.amazonaws.com/online/ele4baxj/59b69b69ce5b4639bb393e5b30b06b2d.jpg,$325,Chalkboard Easel
https://pf-online-inventory-images.s3.us-west-1.amazonaws.com/online/enagn4ca/cbfde4907b25454ca761fd863716a7ad.jpg,$325,Circle dark leather quilted chair 
https://pf-online-inventory-images.s3.us-west-1.amazonaws.com/online/30kykayj/2374045d12ad4122b6cf6699854c492f.jpg,$545,"Vail Dining Chair, Walnut, Black Leather AS IS small torn corner"
https://pf-online-inventory-images.s3.us-west-1.amazonaws.com/online/3rx0uoaw/529eaefa3f6b4f42a94ba9dfc741ab73.jpg,$338,Kareen square white concrete block indoor/ outdoor coffee table
https://pf-online-inventory-images.s3.us-west-1.amazonaws.com/online/lf5jouks/360004067d1b4f549c8d3cae161ba8a4.jpg,$395,Romweber oblong dark oak double-sided drawer coffee table
https://pf-online-inventory-images.s3.us-west-1.amazonaws.com/online/eujdh3sm/9b93a76014094617aef9a2dce985ba9f.jpg,$445,Rectangular low Asian carved dark wood coffee table with glass top
https://pf-online-inventory-images.s3.us-west-1.amazonaws.com/online/tgvfcmfa/0f658952318c4bc1bb70143d0025f386.jpg,$495,Romweber octagon carved dark oak side table
https://pf-online-inventory-images.s3.us-west-1.amazonaws.com/online/mylgjbc1/a87ef67757184bf4865e70c167ec6264.jpg,$122,"Vintage tool box, Vintage tools included. "
https://pf-online-inventory-images.s3.us-west-1.amazonaws.com/online/5eziaitr/196c81779cac4921945b1c137ba095b4.jpg,$145,Unique porcelain based side table painted driftwood slab of garden of the gods top
https://pf-online-inventory-images.s3.us-west-1.amazonaws.com/online/r3hgwti4/ce777f8bdec34e5db4f83bd689598791.jpg,$248,Brigantine dark brown finish wood 2 door TV stand with open storage & 2 glass shelves 
